Authors,Title,Year,Source title,Volume,Issue,Art. No.,Page start,Page end,Page count,Cited by,DOI,Link,Document Type,Access Type,Source,EID
"McCabe, K.O., Fleeson, W.","What Is Extraversion For? Integrating Trait and Motivational Perspectives and Identifying the Purpose of Extraversion",2012,"Psychological Science","23","12",,"1498","1505",,44,10.1177/0956797612444904,"https://www.scopus.com/inward/record.uri?eid=2-s2.0-84871189771&doi=10.1177%2f0956797612444904&partnerID=40&md5=312509274a8d1d80e1517e6971a82701",Article,,Scopus,2-s2.0-84871189771
"Neville, L.","Do Economic Equality and Generalized Trust Inhibit Academic Dishonesty? Evidence From State-Level Search-Engine Queries",2012,"Psychological Science","23","4",,"339","345",,37,10.1177/0956797611435980,"https://www.scopus.com/inward/record.uri?eid=2-s2.0-84859829966&doi=10.1177%2f0956797611435980&partnerID=40&md5=cee73c41c82ca6512fbcb173a790d772",Article,,Scopus,2-s2.0-84859829966
"Buehner, M.J.","Understanding the Past, Predicting the Future: Causation, Not Intentional Action, Is the Root of Temporal Binding",2012,"Psychological Science","23","12",,"1490","1497",,44,10.1177/0956797612444612,"https://www.scopus.com/inward/record.uri?eid=2-s2.0-84871231047&doi=10.1177%2f0956797612444612&partnerID=40&md5=514547d4ef0de747d1297a9e0e2cb78e",Article,,Scopus,2-s2.0-84871231047
"Guinote, A., Weick, M., Cai, A.","Does Power Magnify the Expression of Dispositions?",2012,"Psychological Science","23","5",,"475","482",,30,10.1177/0956797611428472,"https://www.scopus.com/inward/record.uri?eid=2-s2.0-84861731568&doi=10.1177%2f0956797611428472&partnerID=40&md5=026cf25ea495c4b64dd21d454482d758",Article,,Scopus,2-s2.0-84861731568
"Chandler, J.J., Pronin, E.","Fast Thought Speed Induces Risk Taking",2012,"Psychological Science","23","4",,"370","374",,14,10.1177/0956797611431464,"https://www.scopus.com/inward/record.uri?eid=2-s2.0-84859865685&doi=10.1177%2f0956797611431464&partnerID=40&md5=411c2ba40d51a400d6885adfb6e69b0d",Article,,Scopus,2-s2.0-84859865685
"Goslin, J., Dixon, T., Fischer, M.H., Cangelosi, A., Ellis, R.","Electrophysiological examination of embodiment in vision and action",2012,"Psychological Science","23","2",,"152","157",,30,10.1177/0956797611429578,"https://www.scopus.com/inward/record.uri?eid=2-s2.0-84856497561&doi=10.1177%2f0956797611429578&partnerID=40&md5=262fa4c0bd5d88c6e1c2cc2e64ba8349",Article,,Scopus,2-s2.0-84856497561
"Hannula, D.E., Baym, C.L., Warren, D.E., Cohen, N.J.","The eyes know: Eye movements as a veridical index of memory",2012,"Psychological Science","23","3",,"278","287",,26,10.1177/0956797611429799,"https://www.scopus.com/inward/record.uri?eid=2-s2.0-84858220499&doi=10.1177%2f0956797611429799&partnerID=40&md5=378535c607778b1981c1c1cbe27a2574",Article,,Scopus,2-s2.0-84858220499
"Harden, K.P.","True Love Waits? A Sibling-Comparison Study of Age at First Sexual Intercourse and Romantic Relationships in Young Adulthood",2012,"Psychological Science","23","11",,"1324","1336",,13,10.1177/0956797612442550,"https://www.scopus.com/inward/record.uri?eid=2-s2.0-84868544228&doi=10.1177%2f0956797612442550&partnerID=40&md5=a2c6b0e4f61b65170e0cc6d7f8406df6",Article,,Scopus,2-s2.0-84868544228
"Eich, E.","Principles and plans",2012,"Psychological Science","23","1",,"3","5",,,10.1177/0956797611433280,"https://www.scopus.com/inward/record.uri?eid=2-s2.0-84855502038&doi=10.1177%2f0956797611433280&partnerID=40&md5=431e424b9907cc23d82b32ae2bb27c16",Editorial,,Scopus,2-s2.0-84855502038
"Livingston, R.W., Rosette, A.S., Washington, E.F.","Can an Agentic Black Woman Get Ahead? The Impact of Race and Interpersonal Dominance on Perceptions of Female Leaders",2012,"Psychological Science","23","4",,"354","358",,66,10.1177/0956797611428079,"https://www.scopus.com/inward/record.uri?eid=2-s2.0-84859866355&doi=10.1177%2f0956797611428079&partnerID=40&md5=74a27092bc14e387b8962c7921202cb6",Article,,Scopus,2-s2.0-84859866355
"Machizawa, M.G., Goh, C.C.W., Driver, J.","Human Visual Short-Term Memory Precision Can Be Varied at Will When the Number of Retained Items Is Low",2012,"Psychological Science","23","6",,"554","559",,38,10.1177/0956797611431988,"https://www.scopus.com/inward/record.uri?eid=2-s2.0-84862238820&doi=10.1177%2f0956797611431988&partnerID=40&md5=bce0b41de41af6caa0402d558e42dab1",Article,,Scopus,2-s2.0-84862238820
"Laurin, K., Kay, A.C., Fitzsimons, G.J.","Reactance versus rationalization: Divergent responses to policies that constrain freedom",2012,"Psychological Science","23","2",,"205","209",,34,10.1177/0956797611429468,"https://www.scopus.com/inward/record.uri?eid=2-s2.0-84856430284&doi=10.1177%2f0956797611429468&partnerID=40&md5=d2b2082133725592808069fd15795c96",Article,,Scopus,2-s2.0-84856430284
"Blechert, J., Sheppes, G., Tella, C., Williams, H., Gross, J.J.","See What You Think: Reappraisal Modulates Behavioral and Neural Responses to Social Stimuli",2012,"Psychological Science","23","4",,"346","353",,27,10.1177/0956797612438559,"https://www.scopus.com/inward/record.uri?eid=2-s2.0-84859879387&doi=10.1177%2f0956797612438559&partnerID=40&md5=ef55e4bc3f5c207b3e14796c64e74951",Article,,Scopus,2-s2.0-84859879387
"Inesi, M.E., Botti, S., Dubois, D., Rucker, D.D., Galinsky, A.D.","Power and choice: Their dynamic interplay in quenching the thirst for personal control",2011,"Psychological Science","22","8",,"1042","1048",,58,10.1177/0956797611413936,"https://www.scopus.com/inward/record.uri?eid=2-s2.0-80051629401&doi=10.1177%2f0956797611413936&partnerID=40&md5=d98a93fde65bb21b98b81bd401e2cd75",Article,,Scopus,2-s2.0-80051629401
"Gadassi, R., Mor, N., Rafaeli, E.","Depression and empathic accuracy in couples: An interpersonal model of gender differences in depression",2011,"Psychological Science","22","8",,"1033","1041",,26,10.1177/0956797611414728,"https://www.scopus.com/inward/record.uri?eid=2-s2.0-80051620390&doi=10.1177%2f0956797611414728&partnerID=40&md5=74aeebfecc5deabe4cee893931df8b7e",Article,,Scopus,2-s2.0-80051620390
"Simonsohn, U.","Spurious also?: Name-similarity effects (implicit egotism) in employment decisions",2011,"Psychological Science","22","8",,"1087","1089",,7,10.1177/0956797611413937,"https://www.scopus.com/inward/record.uri?eid=2-s2.0-80051633904&doi=10.1177%2f0956797611413937&partnerID=40&md5=76902eafe1229dcc59a78676bc647a38",Article,,Scopus,2-s2.0-80051633904
"Blackie, L.E.R., Cozzolino, P.J.","Of blood and death: A test of dual-existential systems in the context of prosocial intentions",2011,"Psychological Science","22","8",,"998","1000",,10,10.1177/0956797611415542,"https://www.scopus.com/inward/record.uri?eid=2-s2.0-80051626019&doi=10.1177%2f0956797611415542&partnerID=40&md5=a89c76ca92508f2dc66784eea8bae17c",Article,,Scopus,2-s2.0-80051626019
"Khan, S.A., Levine, W.J., Dobson, S.D., Kralik, J.D.","Red signals dominance in male rhesus macaques",2011,"Psychological Science","22","8",,"1001","1003",,23,10.1177/0956797611415543,"https://www.scopus.com/inward/record.uri?eid=2-s2.0-80051606084&doi=10.1177%2f0956797611415543&partnerID=40&md5=5a1ffeb4b0ae842109c9ea45a019c917",Article,,Scopus,2-s2.0-80051606084
"Na, J., Kitayama, S.","Spontaneous trait inference is culture-specific: Behavioral and neural evidence",2011,"Psychological Science","22","8",,"1025","1032",,56,10.1177/0956797611414727,"https://www.scopus.com/inward/record.uri?eid=2-s2.0-80051634210&doi=10.1177%2f0956797611414727&partnerID=40&md5=01f4c19e64cc3e62dfb81b591104ad95",Article,,Scopus,2-s2.0-80051634210
"Carter, T.J., Ferguson, M.J., Hassin, R.R.","A single exposure to the American flag shifts support toward republicanism up to 8 months later",2011,"Psychological Science","22","8",,"1011","1018",,52,10.1177/0956797611414726,"https://www.scopus.com/inward/record.uri?eid=2-s2.0-80051631372&doi=10.1177%2f0956797611414726&partnerID=40&md5=8e9e5afe98390441ed7a006173c1ba4d",Article,,Scopus,2-s2.0-80051631372
"Ma-Kellams, C., Blascovich, J.","Culturally divergent responses to mortality salience",2011,"Psychological Science","22","8",,"1019","1024",,13,10.1177/0956797611413935,"https://www.scopus.com/inward/record.uri?eid=2-s2.0-80051637636&doi=10.1177%2f0956797611413935&partnerID=40&md5=5209e9d5519b23753adf1b72905193b1",Article,,Scopus,2-s2.0-80051637636
"Joormann, J., Levens, S.M., Gotlib, I.H.","Sticky thoughts: Depression and rumination are associated with difficulties manipulating emotional material in working memory",2011,"Psychological Science","22","8",,"979","983",,64,10.1177/0956797611415539,"https://www.scopus.com/inward/record.uri?eid=2-s2.0-80051661990&doi=10.1177%2f0956797611415539&partnerID=40&md5=1dc6377d1b93cca0a322daa787ab49b0",Article,,Scopus,2-s2.0-80051661990
"Gabriel, S., Young, A.F.","Becoming a vampire without being bitten: The narrative collective-assimilation hypothesis",2011,"Psychological Science","22","8",,"990","994",,39,10.1177/0956797611415541,"https://www.scopus.com/inward/record.uri?eid=2-s2.0-80051652233&doi=10.1177%2f0956797611415541&partnerID=40&md5=eb7a6d52dec2e89c07843ce9fdb18992",Article,,Scopus,2-s2.0-80051652233
"Chiou, W.-B., Yang, C.-C., Wan, C.-S.","Ironic effects of dietary supplementation: Illusory invulnerability created by taking dietary supplements licenses health-risk behaviors",2011,"Psychological Science","22","8",,"1081","1086",,31,10.1177/0956797611416253,"https://www.scopus.com/inward/record.uri?eid=2-s2.0-80051604469&doi=10.1177%2f0956797611416253&partnerID=40&md5=f0c836bd5a13584d2fc80edae816adc5",Article,,Scopus,2-s2.0-80051604469
"Wagner, K., Dobkins, K.R.","Synaesthetic associations decrease during infancy",2011,"Psychological Science","22","8",,"1067","1072",,24,10.1177/0956797611416250,"https://www.scopus.com/inward/record.uri?eid=2-s2.0-80051631693&doi=10.1177%2f0956797611416250&partnerID=40&md5=a2f18ce9ec6a31f710dacf4d53956d80",Article,,Scopus,2-s2.0-80051631693
"Spencer, J.P., Perone, S., Smith, L.B., Samuelson, L.K.","Learning words in space and time: Probing the mechanisms behind the suspicious-coincidence effect",2011,"Psychological Science","22","8",,"1049","1057",,14,10.1177/0956797611413934,"https://www.scopus.com/inward/record.uri?eid=2-s2.0-80051602259&doi=10.1177%2f0956797611413934&partnerID=40&md5=1d2981507584890988dd3a1f8c99b631",Article,,Scopus,2-s2.0-80051602259
"Back, M.D., Penke, L., Schmukle, S.C., Asendorpf, J.B.","Knowing your own mate value: Sex-specific personality effects on the accuracy of expected mate choices",2011,"Psychological Science","22","8",,"984","989",,12,10.1177/0956797611414725,"https://www.scopus.com/inward/record.uri?eid=2-s2.0-80051647312&doi=10.1177%2f0956797611414725&partnerID=40&md5=8c81720fffdbd9af8b2a76b90d520b4d",Article,,Scopus,2-s2.0-80051647312
"Côté, S., DeCelles, K.A., McCarthy, J.M., van Kleef, G.A., Hideg, I.","The jekyll and hyde of emotional intelligence: Emotion-regulation knowledge facilitates both prosocial and interpersonally deviant behavior",2011,"Psychological Science","22","8",,"1073","1080",,53,10.1177/0956797611416251,"https://www.scopus.com/inward/record.uri?eid=2-s2.0-80051631371&doi=10.1177%2f0956797611416251&partnerID=40&md5=5e08f876ad71b225fb2397140cca0e5b",Article,,Scopus,2-s2.0-80051631371
"Farzin, F., Rivera, S.M., Whitney, D.","Time crawls: The temporal resolution of infants' visual attention",2011,"Psychological Science","22","8",,"1004","1010",,9,10.1177/0956797611413291,"https://www.scopus.com/inward/record.uri?eid=2-s2.0-80051605753&doi=10.1177%2f0956797611413291&partnerID=40&md5=a22d0a068c90212fe4aa017fe98e95a0",Article,,Scopus,2-s2.0-80051605753
"Nagengast, B., Marsh, H.W., Scalas, L.F., Xu, M.K., Hau, K.-T., Trautwein, U.","Who took the ""×"" out of expectancy-value theory?: A psychological mystery, a substantive-methodological synergy, and a cross-national generalization",2011,"Psychological Science","22","8",,"1058","1066",,86,10.1177/0956797611415540,"https://www.scopus.com/inward/record.uri?eid=2-s2.0-80051627491&doi=10.1177%2f0956797611415540&partnerID=40&md5=3cdb6832c30bb5aa2b14ea2a3c4137c8",Article,,Scopus,2-s2.0-80051627491
"Tangen, J.M., Thompson, M.B., McCarthy, D.J.","Identifying fingerprint expertise",2011,"Psychological Science","22","8",,"995","997",,41,10.1177/0956797611414729,"https://www.scopus.com/inward/record.uri?eid=2-s2.0-80051629711&doi=10.1177%2f0956797611414729&partnerID=40&md5=0f2ee8a1c7c4abd4688e12804b204d21",Article,,Scopus,2-s2.0-80051629711
"Gollwitzer, P.M., Sheeran, P., Trötschel, R., Webb, T.L.","Self-regulation of priming effects on behavior",2011,"Psychological Science","22","7",,"901","907",,23,10.1177/0956797611411586,"https://www.scopus.com/inward/record.uri?eid=2-s2.0-79960457011&doi=10.1177%2f0956797611411586&partnerID=40&md5=c8a7040bfec9c6fd3ee4dcfeb2a53147",Article,,Scopus,2-s2.0-79960457011
"Huibregtse, B.M., Bornovalova, M.A., Hicks, B.M., McGue, M., Iacono, W.","Testing the role of adolescent sexual initiation in later-life sexual risk behavior: A longitudinal twin design",2011,"Psychological Science","22","7",,"924","933",,15,10.1177/0956797611410982,"https://www.scopus.com/inward/record.uri?eid=2-s2.0-79960453180&doi=10.1177%2f0956797611410982&partnerID=40&md5=82a574cade2f84160686181171bc3f2c",Article,,Scopus,2-s2.0-79960453180
"Houben, K., Wiers, R.W., Jansen, A.","Getting a Grip on Drinking Behavior: Training Working Memory to Reduce Alcohol Abuse",2011,"Psychological Science","22","7",,"968","975",,171,10.1177/0956797611412392,"https://www.scopus.com/inward/record.uri?eid=2-s2.0-79960463315&doi=10.1177%2f0956797611412392&partnerID=40&md5=bdfe2754a43f362d90a46ff264ea7a26",Article,,Scopus,2-s2.0-79960463315
"McDonald, M.M., Asher, B.D., Kerr, N.L., Navarrete, C.D.","Fertility and intergroup bias in racial and minimal-group contexts: Evidence for shared architecture",2011,"Psychological Science","22","7",,"860","865",,23,10.1177/0956797611410985,"https://www.scopus.com/inward/record.uri?eid=2-s2.0-79960443024&doi=10.1177%2f0956797611410985&partnerID=40&md5=685d69801aef2ca0e60393343c0ba37b",Article,,Scopus,2-s2.0-79960443024
"de Vries, J.P., Hooge, I.T.C., Wiering, M.A., Verstraten, F.A.J.","How longer saccade latencies lead to a competition for salience",2011,"Psychological Science","22","7",,"916","923",,11,10.1177/0956797611410572,"https://www.scopus.com/inward/record.uri?eid=2-s2.0-79960463238&doi=10.1177%2f0956797611410572&partnerID=40&md5=0fefb6a42d310f3ffdfc8846a12cd054",Article,,Scopus,2-s2.0-79960463238
"Mazar, N., Aggarwal, P.","Greasing the Palm: Can Collectivism Promote Bribery?",2011,"Psychological Science","22","7",,"843","848",,60,10.1177/0956797611412389,"https://www.scopus.com/inward/record.uri?eid=2-s2.0-79960470760&doi=10.1177%2f0956797611412389&partnerID=40&md5=208faf12ded414f02f1457aafdae86c8",Article,,Scopus,2-s2.0-79960470760
"Roseboom, W., Arnold, D.H.","Twice Upon a Time: Multiple Concurrent Temporal Recalibrations of Audiovisual Speech",2011,"Psychological Science","22","7",,"872","877",,38,10.1177/0956797611413293,"https://www.scopus.com/inward/record.uri?eid=2-s2.0-79960439941&doi=10.1177%2f0956797611413293&partnerID=40&md5=3073320d32c7087c7fed839f35e77631",Article,,Scopus,2-s2.0-79960439941
"Guendelman, M.D., Cheryan, S., Monin, B.","Fitting in But Getting Fat: Identity Threat and Dietary Choices Among U.S. Immigrant Groups",2011,"Psychological Science","22","7",,"959","967",,67,10.1177/0956797611411585,"https://www.scopus.com/inward/record.uri?eid=2-s2.0-79960443025&doi=10.1177%2f0956797611411585&partnerID=40&md5=df9c34e00730f3c57ea62da7cd8342f3",Article,,Scopus,2-s2.0-79960443025
"Willems, R.M., Labruna, L., D'Esposito, M., Ivry, R., Casasanto, D.","A Functional Role for The Motor System in Language Understanding: Evidence from Theta-Burst Transcranial Magnetic Stimulation",2011,"Psychological Science","22","7",,"849","854",,59,10.1177/0956797611412387,"https://www.scopus.com/inward/record.uri?eid=2-s2.0-79960449686&doi=10.1177%2f0956797611412387&partnerID=40&md5=059730d813157967a10828d9ff634586",Article,,Scopus,2-s2.0-79960449686
"Sweeny, T.D., Grabowecky, M., Suzuki, S.","Awareness Becomes Necessary Between Adaptive Pattern Coding of Open and Closed Curvatures",2011,"Psychological Science","22","7",,"943","950",,18,10.1177/0956797611413292,"https://www.scopus.com/inward/record.uri?eid=2-s2.0-79960461408&doi=10.1177%2f0956797611413292&partnerID=40&md5=071fc4a310b5d9021ba7d5e0c71d163a",Article,,Scopus,2-s2.0-79960461408
"Oriña, M.M., Collins, W.A., Simpson, J.A., Salvatore, J.E., Haydon, K.C., Kim, J.S.","Developmental and dyadic perspectives on commitment in adult romantic relationships",2011,"Psychological Science","22","7",,"908","915",,16,10.1177/0956797611410573,"https://www.scopus.com/inward/record.uri?eid=2-s2.0-79960449545&doi=10.1177%2f0956797611410573&partnerID=40&md5=0a484e3141fdcf3c6991778b18e767a5",Article,,Scopus,2-s2.0-79960449545
"Tapia, E., Breitmeyer, B.G.","Visual Consciousness Revisited: Magnocellular and Parvocellular Contributions to Conscious and Nonconscious Vision",2011,"Psychological Science","22","7",,"934","942",,28,10.1177/0956797611413471,"https://www.scopus.com/inward/record.uri?eid=2-s2.0-79960461592&doi=10.1177%2f0956797611413471&partnerID=40&md5=7bf379cb8695adc04dceabd536a2a7f3",Article,,Scopus,2-s2.0-79960461592
"Cain, M.S., Dunsmoor, J.E., LaBar, K.S., Mitroff, S.R.","Anticipatory Anxiety Hinders Detection of a Second Target in Dual-Target Search",2011,"Psychological Science","22","7",,"866","871",,20,10.1177/0956797611412393,"https://www.scopus.com/inward/record.uri?eid=2-s2.0-79960467521&doi=10.1177%2f0956797611412393&partnerID=40&md5=05bd76be9bcb9fb22572aea7c3e6e7f2",Article,,Scopus,2-s2.0-79960467521
"Zaki, J., Schirmer, J., Mitchell, J.P.","Social influence modulates the neural computation of value",2011,"Psychological Science","22","7",,"894","900",,127,10.1177/0956797611411057,"https://www.scopus.com/inward/record.uri?eid=2-s2.0-79960455649&doi=10.1177%2f0956797611411057&partnerID=40&md5=de005bb3e2f5c25393d8293ef65e248b",Article,,Scopus,2-s2.0-79960455649
"Lakens, D., Schneider, I.K., Jostmann, N.B., Schubert, T.W.","Telling Things Apart: The Distance Between Response Keys Influences Categorization Times",2011,"Psychological Science","22","7",,"887","890",,16,10.1177/0956797611412391,"https://www.scopus.com/inward/record.uri?eid=2-s2.0-79960463061&doi=10.1177%2f0956797611412391&partnerID=40&md5=b07327d07b7984e864f79c0118ebf501",Article,,Scopus,2-s2.0-79960463061
"Dhooge, E., Hartsuiker, R.J.","How do speakers resist distraction?: Evidence from a taboo picture-word interference task",2011,"Psychological Science","22","7",,"855","859",,13,10.1177/0956797611410984,"https://www.scopus.com/inward/record.uri?eid=2-s2.0-79960439938&doi=10.1177%2f0956797611410984&partnerID=40&md5=6644381928120882113a77d62afaaf46",Article,,Scopus,2-s2.0-79960439938
"Saguy, T., Kteily, N.","Inside the Opponent's Head: Perceived Losses in Group Position Predict Accuracy in Metaperceptions Between Groups",2011,"Psychological Science","22","7",,"951","958",,9,10.1177/0956797611412388,"https://www.scopus.com/inward/record.uri?eid=2-s2.0-79960442276&doi=10.1177%2f0956797611412388&partnerID=40&md5=a6162da104304a03cf169cd26eb678eb",Article,,Scopus,2-s2.0-79960442276
"Berger, J.","Arousal Increases Social Transmission of Information",2011,"Psychological Science","22","7",,"891","893",,117,10.1177/0956797611413294,"https://www.scopus.com/inward/record.uri?eid=2-s2.0-79960473223&doi=10.1177%2f0956797611413294&partnerID=40&md5=9684b322c8aeaf7918f2a2d74b4276ef",Article,,Scopus,2-s2.0-79960473223
"Rule, N.O., Rosen, K.S., Slepian, M.L., Ambady, N.","Mating Interest Improves Women's Accuracy in Judging Male Sexual Orientation",2011,"Psychological Science","22","7",,"881","886",,29,10.1177/0956797611412394,"https://www.scopus.com/inward/record.uri?eid=2-s2.0-79960471062&doi=10.1177%2f0956797611412394&partnerID=40&md5=6e45b2bfc10c93e7eed028f2fa77ffd0",Article,,Scopus,2-s2.0-79960471062
"Senju, A., Southgate, V., Snape, C., Leonard, M., Csibra, G.","Do 18-month-olds really attribute mental states to others?: A critical test",2011,"Psychological Science","22","7",,"878","880",,68,10.1177/0956797611411584,"https://www.scopus.com/inward/record.uri?eid=2-s2.0-79960441289&doi=10.1177%2f0956797611411584&partnerID=40&md5=606e49176e61945b9ec8ffcc1fb416f6",Article,,Scopus,2-s2.0-79960441289
"Orgs, G., Bestmann, S., Schuur, F., Haggard, P.","From body form to biological motion: The apparent velocity of human movement biases subjective time",2011,"Psychological Science","22","6",,"712","717",,23,10.1177/0956797611406446,"https://www.scopus.com/inward/record.uri?eid=2-s2.0-79958141622&doi=10.1177%2f0956797611406446&partnerID=40&md5=a51670af14da4a8b2f056cd3d54abbc3",Article,,Scopus,2-s2.0-79958141622
"Evans, K.K., Horowitz, T.S., Wolfe, J.M.","When categories collide: Accumulation of information about multiple categories in rapid scene perception",2011,"Psychological Science","22","6",,"739","746",,22,10.1177/0956797611407930,"https://www.scopus.com/inward/record.uri?eid=2-s2.0-79958115716&doi=10.1177%2f0956797611407930&partnerID=40&md5=61d3b270ff602ac52f672305c57a5fe9",Article,,Scopus,2-s2.0-79958115716
"Frank, S.L., Bod, R.","Insensitivity of the human sentence-processing system to hierarchical structure",2011,"Psychological Science","22","6",,"829","834",,42,10.1177/0956797611409589,"https://www.scopus.com/inward/record.uri?eid=2-s2.0-79958085119&doi=10.1177%2f0956797611409589&partnerID=40&md5=00a7b4cb70cca7292ac153f43f7bdc48",Article,,Scopus,2-s2.0-79958085119
"Back, M.D., Küfner, A.C.P., Egloff, B.","""Automatic or the people?"" Anger on september 11, 2001, and lessons learned for the analysis of large digital data sets",2011,"Psychological Science","22","6",,"837","838",,19,10.1177/0956797611409592,"https://www.scopus.com/inward/record.uri?eid=2-s2.0-79958101928&doi=10.1177%2f0956797611409592&partnerID=40&md5=f179bcaed7e4cc042e8fc48b06f78cef",Article,,Scopus,2-s2.0-79958101928
"Mudrik, L., Breska, A., Lamy, D., Deouell, L.Y.","Integration without awareness: Expanding the limits of unconscious processing",2011,"Psychological Science","22","6",,"764","770",,113,10.1177/0956797611408736,"https://www.scopus.com/inward/record.uri?eid=2-s2.0-79958180721&doi=10.1177%2f0956797611408736&partnerID=40&md5=41a669a8da3b18cb0323cda0d7a4200d",Article,,Scopus,2-s2.0-79958180721
"Gallivan, J.P., Chapman, C.S., Wood, D.K., Milne, J.L., Ansari, D., Culham, J.C., Goodale, M.A.","One to four, and nothing more: Nonconscious parallel individuation of objects during action planning",2011,"Psychological Science","22","6",,"803","811",,23,10.1177/0956797611408733,"https://www.scopus.com/inward/record.uri?eid=2-s2.0-79958112061&doi=10.1177%2f0956797611408733&partnerID=40&md5=6ac0f63acf027fc8f0cc9e0125e592b4",Article,,Scopus,2-s2.0-79958112061
"Mishra, H., Mishra, A., Shiv, B.","In praise of vagueness: Malleability of vague information as a performance booster",2011,"Psychological Science","22","6",,"733","738",,11,10.1177/0956797611407208,"https://www.scopus.com/inward/record.uri?eid=2-s2.0-79958125302&doi=10.1177%2f0956797611407208&partnerID=40&md5=0324fbba6027af7ba6bb270d21aacfcc",Article,,Scopus,2-s2.0-79958125302
"Buchan, N.R., Brewer, M.B., Grimalda, G., Wilson, R.K., Fatas, E., Foddy, M.","Global social identity and global cooperation",2011,"Psychological Science","22","6",,"821","828",,67,10.1177/0956797611409590,"https://www.scopus.com/inward/record.uri?eid=2-s2.0-79958122435&doi=10.1177%2f0956797611409590&partnerID=40&md5=a9c33151e026f3379ec103bd262df040",Article,,Scopus,2-s2.0-79958122435
"Bastardi, A., Uhlmann, E.L., Ross, L.","Wishful thinking: Belief, desire, and the motivated evaluation of scientific evidence",2011,"Psychological Science","22","6",,"731","732",,33,10.1177/0956797611406447,"https://www.scopus.com/inward/record.uri?eid=2-s2.0-79958171080&doi=10.1177%2f0956797611406447&partnerID=40&md5=2b97801b7cfced8564f1675178a1320b",Note,,Scopus,2-s2.0-79958171080
"Troisi, J.D., Gabriel, S.","Chicken soup really is good for the soul: ""Comfort food"" fulfills the need to belong",2011,"Psychological Science","22","6",,"747","753",,50,10.1177/0956797611407931,"https://www.scopus.com/inward/record.uri?eid=2-s2.0-79958167556&doi=10.1177%2f0956797611407931&partnerID=40&md5=3d6773c0378ff84a0c1e09bf434f3292",Article,,Scopus,2-s2.0-79958167556
"Savani, K., Stephens, N.M., Markus, H.R.","The unanticipated interpersonal and societal consequences of choice: Victim Blaming and reduced support for the public good",2011,"Psychological Science","22","6",,"795","802",,38,10.1177/0956797611407928,"https://www.scopus.com/inward/record.uri?eid=2-s2.0-79958127036&doi=10.1177%2f0956797611407928&partnerID=40&md5=f0c2af434aef44d6545fdc4a518fc5cd",Article,,Scopus,2-s2.0-79958127036
"Kornell, N., Rhodes, M.G., Castel, A.D., Tauber, S.K.","The ease-of-processing heuristic and the stability bias: Dissociating memory, memory beliefs, and memory judgments",2011,"Psychological Science","22","6",,"787","794",,74,10.1177/0956797611407929,"https://www.scopus.com/inward/record.uri?eid=2-s2.0-79958133246&doi=10.1177%2f0956797611407929&partnerID=40&md5=142de61bfc9bfd3c1a496237f1218d0e",Article,,Scopus,2-s2.0-79958133246
"James, G., Koehler, D.J.","Banking on a bad bet: Probability matching in risky choice is linked to expectation generation",2011,"Psychological Science","22","6",,"707","711",,13,10.1177/0956797611407933,"https://www.scopus.com/inward/record.uri?eid=2-s2.0-79958107128&doi=10.1177%2f0956797611407933&partnerID=40&md5=8e119ef4ebf262ca7a1bbd02355cbed6",Article,,Scopus,2-s2.0-79958107128
"Pury, C.L.S.","Automation can lead to confounds in text analysis: Back, Küfner, and Egloff (2010) and the not-so-angry Americans",2011,"Psychological Science","22","6",,"835","836",,9,10.1177/0956797611408735,"https://www.scopus.com/inward/record.uri?eid=2-s2.0-79958153985&doi=10.1177%2f0956797611408735&partnerID=40&md5=b35fdacef97dd8d7ef82e2d2c63e2282",Letter,,Scopus,2-s2.0-79958153985
