Authors,Title,Year,Source title,Volume,Issue,Art. No.,Page start,Page end,Page count,Cited by,DOI,Link,Document Type,Access Type,Source,EID
"Kornell, N., Klein, P.J., Rawson, K.A.","Retrieval attempts enhance learning, but retrieval success (versus failure) does not matter",2015,"Journal of Experimental Psychology: Learning Memory and Cognition","41","1",,"283","294",,14,10.1037/a0037850,"https://www.scopus.com/inward/record.uri?eid=2-s2.0-84925744206&doi=10.1037%2fa0037850&partnerID=40&md5=ce2c4af2d76257966570355408902c4e",Article,,Scopus,2-s2.0-84925744206
"Middleton, E.L., Schwartz, M.F., Rawson, K.A., Garvey, K.","Test-enhanced learning versus errorless learning in aphasia rehabilitation: Testing competing psychological principles",2015,"Journal of Experimental Psychology: Learning Memory and Cognition","41","4",,"1253","1261",,8,10.1037/xlm0000091,"https://www.scopus.com/inward/record.uri?eid=2-s2.0-84936890315&doi=10.1037%2fxlm0000091&partnerID=40&md5=374271b68e3a6c1fa3f09fe5b366efb6",Article,,Scopus,2-s2.0-84936890315
"De Jonge, M., Tabbers, H.K., Pecher, D., Jang, Y., Zeelenberg, R.","The efficacy of self-paced study in multitrial learning",2015,"Journal of Experimental Psychology: Learning Memory and Cognition","41","3",,"851","858",,,10.1037/xlm0000046,"https://www.scopus.com/inward/record.uri?eid=2-s2.0-84946178857&doi=10.1037%2fxlm0000046&partnerID=40&md5=9507d76fa95bb9e9de7164e69f8569bb",Article,,Scopus,2-s2.0-84946178857
"Craik, F.I.M., Rose, N.S., Gopie, N.","Recognition without awareness: Encoding and retrieval factors",2015,"Journal of Experimental Psychology: Learning Memory and Cognition","41","5",,"1271","1281",,3,10.1037/xlm0000137,"https://www.scopus.com/inward/record.uri?eid=2-s2.0-84941190373&doi=10.1037%2fxlm0000137&partnerID=40&md5=f1ad8bd1f80831ce89e2b404edbf0dec",Article,,Scopus,2-s2.0-84941190373
"Elqayam, S., Thompson, V.A., Wilkinson, M.R., Evans, J.S.B.T., Over, D.E.","Deontic introduction: A theory of inference from is to ought",2015,"Journal of Experimental Psychology: Learning Memory and Cognition","41","5",,"1516","1532",,9,10.1037/a0038686,"https://www.scopus.com/inward/record.uri?eid=2-s2.0-84941174353&doi=10.1037%2fa0038686&partnerID=40&md5=ec67c18efeb1fa4370f052e9317a620c",Article,,Scopus,2-s2.0-84941174353
"Kliegl, O., Pastötter, B., Bäuml, K.-H.T.","The contribution of encoding and retrieval processes to proactive interference",2015,"Journal of Experimental Psychology: Learning Memory and Cognition","41","6",,"1778","1789",,4,10.1037/xlm0000096,"https://www.scopus.com/inward/record.uri?eid=2-s2.0-84921471884&doi=10.1037%2fxlm0000096&partnerID=40&md5=d6c1fad570648c5f75523d06bc6ae154",Article,,Scopus,2-s2.0-84921471884
"Knutsen, D., Le Bigot, L.","The influence of reference acceptance and reuse on conversational memory traces",2015,"Journal of Experimental Psychology: Learning Memory and Cognition","41","2",,"574","585",,4,10.1037/xlm0000036,"https://www.scopus.com/inward/record.uri?eid=2-s2.0-84925641954&doi=10.1037%2fxlm0000036&partnerID=40&md5=fa45f34119b336af59a80e7b11af779b",Article,,Scopus,2-s2.0-84925641954
"Horn, S.S., Bayen, U.J.","Modeling criterion shifts and target checking in prospective memory monitoring",2015,"Journal of Experimental Psychology: Learning Memory and Cognition","41","1",,"95","117",,6,10.1037/a0037676,"https://www.scopus.com/inward/record.uri?eid=2-s2.0-84925797490&doi=10.1037%2fa0037676&partnerID=40&md5=50ff53f0c38782f87bc8152abd85075b",Article,,Scopus,2-s2.0-84925797490
"Paciorek, A., Williams, J.N.","Semantic generalization in implicit language learning",2015,"Journal of Experimental Psychology: Learning Memory and Cognition","41","4",,"989","1002",,4,10.1037/xlm0000100,"https://www.scopus.com/inward/record.uri?eid=2-s2.0-84936890603&doi=10.1037%2fxlm0000100&partnerID=40&md5=898ed04963b22abf3760891af17b514d",Article,,Scopus,2-s2.0-84936890603
"Reichle, E.D., Drieghe, D.","Using e-z reader to examine the consequences of fixation-location measurement error",2015,"Journal of Experimental Psychology: Learning Memory and Cognition","41","1",,"262","270",,9,10.1037/a0037090,"https://www.scopus.com/inward/record.uri?eid=2-s2.0-84925714488&doi=10.1037%2fa0037090&partnerID=40&md5=3d1eb3ba6de17ab8701170a0e9ab4f3d",Article,,Scopus,2-s2.0-84925714488
"Donkin, C., Newell, B.R., Kalish, M., Dunn, J.C., Nosofsky, R.M.","Identifying strategy use in category learning tasks: A case for more diagnostic data and models",2015,"Journal of Experimental Psychology: Learning Memory and Cognition","41","4",,"933","948",,9,10.1037/xlm0000083,"https://www.scopus.com/inward/record.uri?eid=2-s2.0-84936890713&doi=10.1037%2fxlm0000083&partnerID=40&md5=4e65c86fe94fbd3f7cb3c32de85493a8",Article,,Scopus,2-s2.0-84936890713
"Kelley, M.R., Neath, I., Surprenant, A.M.","Serial position functions in general knowledge",2015,"Journal of Experimental Psychology: Learning Memory and Cognition","41","6",,"1715","1726",,6,10.1037/xlm0000141,"https://www.scopus.com/inward/record.uri?eid=2-s2.0-84930892172&doi=10.1037%2fxlm0000141&partnerID=40&md5=2e11653fbe2162e75d0f7ff8eb545229",Article,,Scopus,2-s2.0-84930892172
"Veldre, A., Andrews, S.","Parafoveal lexical activation depends on skilled reading proficiency",2015,"Journal of Experimental Psychology: Learning Memory and Cognition","41","2",,"586","595",,13,10.1037/xlm0000039,"https://www.scopus.com/inward/record.uri?eid=2-s2.0-84925685448&doi=10.1037%2fxlm0000039&partnerID=40&md5=627a953c4dc1d87f7de30ef0a3e53d77",Article,,Scopus,2-s2.0-84925685448
"Parks, C.M., Yonelinas, A.P.","The importance of unitization for familiarity-based learning",2015,"Journal of Experimental Psychology: Learning Memory and Cognition","41","3",,"881","903",,20,10.1037/xlm0000068,"https://www.scopus.com/inward/record.uri?eid=2-s2.0-84946187575&doi=10.1037%2fxlm0000068&partnerID=40&md5=d5d5fb7641195bd0bb2433f8220a8938",Article,,Scopus,2-s2.0-84946187575
"Allen, R.J., Havelka, J., Falcon, T., Evans, S., Darling, S.","Modality specificity and integration in working memory: Insights from visuospatial bootstrapping",2015,"Journal of Experimental Psychology: Learning Memory and Cognition","41","3",,"820","830",,10,10.1037/xlm0000058,"https://www.scopus.com/inward/record.uri?eid=2-s2.0-84924672681&doi=10.1037%2fxlm0000058&partnerID=40&md5=f5280f8c42eb32e6530d776799510ef4",Article,,Scopus,2-s2.0-84924672681
"Yan, M., Pan, J., Bélanger, N.N., Shu, H.","Chinese deaf readers have early access to parafoveal semantics",2015,"Journal of Experimental Psychology: Learning Memory and Cognition","41","1",,"254","261",,9,10.1037/xlm0000035,"https://www.scopus.com/inward/record.uri?eid=2-s2.0-84925715387&doi=10.1037%2fxlm0000035&partnerID=40&md5=51c2c1ae2e5bcb38de181090f9ed7870",Article,,Scopus,2-s2.0-84925715387
"Meiran, N., Pereg, M., Kessler, Y., Cole, M.W., Braver, T.S.","The power of instructions: Proactive configuration of stimulus-response translation",2015,"Journal of Experimental Psychology: Learning Memory and Cognition","41","3",,"768","786",,24,10.1037/xlm0000063,"https://www.scopus.com/inward/record.uri?eid=2-s2.0-84928532283&doi=10.1037%2fxlm0000063&partnerID=40&md5=a919f73d30923e85d9d8223aefa87b0b",Article,,Scopus,2-s2.0-84928532283
"Chen, T., Starns, J.J., Rotello, C.M.","A violation of the conditional independence assumption in the two-high-threshold model of recognition memory",2015,"Journal of Experimental Psychology: Learning Memory and Cognition","41","4",,"1215","1222",,5,10.1037/xlm0000077,"https://www.scopus.com/inward/record.uri?eid=2-s2.0-84936890033&doi=10.1037%2fxlm0000077&partnerID=40&md5=18ef3b3dbe25f7b86e4a0ffc5bab920d",Article,,Scopus,2-s2.0-84936890033
"Heyman, T., Van Rensbergen, B., Storms, G., Hutchison, K.A., De Deyne, S.","The influence of working memory load on semantic priming",2015,"Journal of Experimental Psychology: Learning Memory and Cognition","41","3",,"911","920",,12,10.1037/xlm0000050,"https://www.scopus.com/inward/record.uri?eid=2-s2.0-84942522077&doi=10.1037%2fxlm0000050&partnerID=40&md5=086fa0ec915b23e95261dd7b5b022c08",Article,,Scopus,2-s2.0-84942522077
"Geng, J., Schnur, T.T.","The representation of concrete and abstract concepts: Categorical versus associative relationships",2015,"Journal of Experimental Psychology: Learning Memory and Cognition","41","1",,"22","41",,5,10.1037/a0037430,"https://www.scopus.com/inward/record.uri?eid=2-s2.0-84925728794&doi=10.1037%2fa0037430&partnerID=40&md5=79ad882b6dc38dd893187b1dff7c090a",Article,,Scopus,2-s2.0-84925728794
[No author name available],"Correction to Shao et al. [Selective Inhibition and Naming Performance in Semantic Blocking, Picture-Word Interference, and Color-Word Stroop Tasks. Journal of Experimental Psychology: Learning, Memory, and Cognition, (2015). http://dx.doi.org/10.1037/a0039363]",2015,"Journal of Experimental Psychology: Learning Memory and Cognition","41","6",,"1820","1820",,,10.1037/xlm0000169,"https://www.scopus.com/inward/record.uri?eid=2-s2.0-84977447700&doi=10.1037%2fxlm0000169&partnerID=40&md5=5a0aa41fae96c0730597e848f9c92c10",Erratum,,Scopus,2-s2.0-84977447700
"Mulligan, N.W., Peterson, D.J.","The negative testing and negative generation effects are eliminated by delay",2015,"Journal of Experimental Psychology: Learning Memory and Cognition","41","4",,"1014","1025",,1,10.1037/xlm0000070,"https://www.scopus.com/inward/record.uri?eid=2-s2.0-84936859775&doi=10.1037%2fxlm0000070&partnerID=40&md5=dfe8629b1985405f2bfe02efff20e90c",Article,,Scopus,2-s2.0-84936859775
"Yap, M.J., Sibley, D.E., Balota, D.A., Ratcliff, R., Rueckl, J.","Responding to nonwords in the lexical decision task: Insights from the english Lexicon project",2015,"Journal of Experimental Psychology: Learning Memory and Cognition","41","3",,"597","613",,9,10.1037/xlm0000064,"https://www.scopus.com/inward/record.uri?eid=2-s2.0-84946162908&doi=10.1037%2fxlm0000064&partnerID=40&md5=9b239b206d3b7e28dc1e1ee218449993",Article,,Scopus,2-s2.0-84946162908
"Gambi, C., Van de Cavey, J., Pickering, M.J.","Interference in joint picture naming",2015,"Journal of Experimental Psychology: Learning Memory and Cognition","41","1",,"1","21",,3,10.1037/a0037438,"https://www.scopus.com/inward/record.uri?eid=2-s2.0-84925807532&doi=10.1037%2fa0037438&partnerID=40&md5=5c5ae5530ce69721a4ff6bcd231c61a1",Article,,Scopus,2-s2.0-84925807532
"Rey, A.E., Riou, B., Muller, D., Dabic, S., Versace, R.","'The mask who wasn't there': Visual masking effect with the perceptual absence of the mask",2015,"Journal of Experimental Psychology: Learning Memory and Cognition","41","2",,"567","573",,5,10.1037/xlm0000051,"https://www.scopus.com/inward/record.uri?eid=2-s2.0-84925585176&doi=10.1037%2fxlm0000051&partnerID=40&md5=7e5aaae26113f28265a85e84155c8117",Article,,Scopus,2-s2.0-84925585176
"Wantz, A.L., Borst, G., Mast, F.W., Lobmaier, J.S.","Colors in mind: A novel paradigm to investigate pure color imagery",2015,"Journal of Experimental Psychology: Learning Memory and Cognition","41","4",,"1152","1161",,,10.1037/xlm0000079,"https://www.scopus.com/inward/record.uri?eid=2-s2.0-84936888312&doi=10.1037%2fxlm0000079&partnerID=40&md5=81eb22308d88e31e7c2c2e4289482096",Article,,Scopus,2-s2.0-84936888312
"Geringswald, F., Herbik, A., Hofmüller, W., Hoffmann, M.B., Pollmann, S.","Visual memory for objects following foveal vision loss",2015,"Journal of Experimental Psychology: Learning Memory and Cognition","41","5",,"1471","1484",,2,10.1037/xlm0000112,"https://www.scopus.com/inward/record.uri?eid=2-s2.0-84941168673&doi=10.1037%2fxlm0000112&partnerID=40&md5=492e6edd92090f34e682b9451650c215",Article,,Scopus,2-s2.0-84941168673
"Spalding, T.L., Gagné, C.L.","Property attribution in combined concepts",2015,"Journal of Experimental Psychology: Learning Memory and Cognition","41","3",,"693","707",,1,10.1037/xlm0000085,"https://www.scopus.com/inward/record.uri?eid=2-s2.0-84946195038&doi=10.1037%2fxlm0000085&partnerID=40&md5=4b1a50546dd19513a4a6435bb0dddd44",Article,,Scopus,2-s2.0-84946195038
"Luke, S.G., Henderson, J.M., Ferreira, F.","Children's eye-movements during reading reflect the quality of lexical representations: An individual differences approach",2015,"Journal of Experimental Psychology: Learning Memory and Cognition","41","6",,"1675","1683",,4,10.1037/xlm0000133,"https://www.scopus.com/inward/record.uri?eid=2-s2.0-84929850590&doi=10.1037%2fxlm0000133&partnerID=40&md5=48b007caefd206cd7607fe58a6cbd035",Article,,Scopus,2-s2.0-84929850590
"Cleary, A.M., Claxton, A.B.","The tip-of-the-tongue heuristic: How tip-of-the-tongue states confer perceptibility on inaccessible words",2015,"Journal of Experimental Psychology: Learning Memory and Cognition","41","5",,"1533","1539",,1,10.1037/xlm0000097,"https://www.scopus.com/inward/record.uri?eid=2-s2.0-84941179752&doi=10.1037%2fxlm0000097&partnerID=40&md5=6bb78509e1091e859d27458b88782280",Article,,Scopus,2-s2.0-84941179752
"Cortis, C., Dent, K., Kennett, S., Ward, G.","First things first: Similar list length and output order effects for verbal and nonverbal stimuli",2015,"Journal of Experimental Psychology: Learning Memory and Cognition","41","4",,"1179","1214",,9,10.1037/xlm0000086,"https://www.scopus.com/inward/record.uri?eid=2-s2.0-84936891626&doi=10.1037%2fxlm0000086&partnerID=40&md5=cd640fde1d816b3f44edf33d9e95dd80",Article,,Scopus,2-s2.0-84936891626
"Hurlstone, M.J., Hitch, G.J.","How is the serial order of a spatial sequence represented? Insights from transposition latencies",2015,"Journal of Experimental Psychology: Learning Memory and Cognition","41","2",,"295","324",,5,10.1037/a0038223,"https://www.scopus.com/inward/record.uri?eid=2-s2.0-84925626129&doi=10.1037%2fa0038223&partnerID=40&md5=cfe49f6cd1011942da3e8b0f5b89de88",Article,,Scopus,2-s2.0-84925626129
"Gwilliams, L.E., Monahan, P.J., Samuel, A.G.","Sensitivity to morphological composition in spoken word recognition: Evidence from grammatical and lexical identification tasks",2015,"Journal of Experimental Psychology: Learning Memory and Cognition","41","6",,"1663","1674",,,10.1037/xlm0000130,"https://www.scopus.com/inward/record.uri?eid=2-s2.0-84929001046&doi=10.1037%2fxlm0000130&partnerID=40&md5=714161906cdfa2d45ab1efeffad22733",Article,,Scopus,2-s2.0-84929001046
"Reimer, J.F., Radvansky, G.A., Lorsbach, T.C., Armendarez, J.J.","Event structure and cognitive control",2015,"Journal of Experimental Psychology: Learning Memory and Cognition","41","5",,"1374","1387",,6,10.1037/xlm0000105,"https://www.scopus.com/inward/record.uri?eid=2-s2.0-84941175965&doi=10.1037%2fxlm0000105&partnerID=40&md5=74b207fd120ef5a40ff60d0b7fe81b65",Article,,Scopus,2-s2.0-84941175965
"Van't Wout, F., Lavric, A., Monsell, S.","Is it harder to switch among a larger set of tasks?",2015,"Journal of Experimental Psychology: Learning Memory and Cognition","41","2",,"363","376",,1,10.1037/a0038268,"https://www.scopus.com/inward/record.uri?eid=2-s2.0-84925717190&doi=10.1037%2fa0038268&partnerID=40&md5=e223586557ece1508daf147753d8207d",Article,,Scopus,2-s2.0-84925717190
"Geringswald, F., Pollmann, S.","Central and peripheral vision loss differentially affects contextual cueing in visual search",2015,"Journal of Experimental Psychology: Learning Memory and Cognition","41","5",,"1485","1496",,1,10.1037/xlm0000117,"https://www.scopus.com/inward/record.uri?eid=2-s2.0-84941170811&doi=10.1037%2fxlm0000117&partnerID=40&md5=2ca80755b65653513045d23da4bad113",Article,,Scopus,2-s2.0-84941170811
"Shao, Z., Roelofs, A., Martin, R.C., Meyer, A.S.","Selective inhibition and naming performance in semantic blocking, picture-word interference, and color-word stroop tasks",2015,"Journal of Experimental Psychology: Learning Memory and Cognition","41","6",,"1806","1819",,7,10.1037/a0039363,"https://www.scopus.com/inward/record.uri?eid=2-s2.0-84930340801&doi=10.1037%2fa0039363&partnerID=40&md5=c4e68d4fc0440790e86da37fd90fba91",Article,,Scopus,2-s2.0-84930340801
"Kellen, D., Klauer, K.C.","Discrete-state and continuous models of recognition memory: Testing core properties under minimal assumptions",2014,"Journal of Experimental Psychology: Learning Memory and Cognition","40","6",,"1795","1804",,8,10.1037/xlm0000016,"https://www.scopus.com/inward/record.uri?eid=2-s2.0-84907510872&doi=10.1037%2fxlm0000016&partnerID=40&md5=765cb8d74de14e1c311f8cd82479fe27",Article,,Scopus,2-s2.0-84907510872
"Macken, B., Taylor, J.C., Jones, D.M.","Language and short-term memory: The role of perceptual-motor affordance",2014,"Journal of Experimental Psychology: Learning Memory and Cognition","40","5",,"1257","1270",,8,10.1037/a0036845,"https://www.scopus.com/inward/record.uri?eid=2-s2.0-84906490913&doi=10.1037%2fa0036845&partnerID=40&md5=ac7c5dcf3dc7588ffe094545800ba93c",Article,Open Access,Scopus,2-s2.0-84906490913
"Reyna, V.F., Estrada, S.M., DeMarinis, J.A., Myers, R.M., Stanisz, J.M., Mills, B.A.","erratum to Neurobiological and Memory Models of Risky Decision Making in Adolescents Versus Young Adults [Journal of Experimental Psychology: Learning, Memory, and Cognition, (2011), 37(5), 1125-1142] Doi: 10.1037/a0023943",2014,"Journal of Experimental Psychology: Learning Memory and Cognition","40","5",,"1431","",,,10.1037/xlm0000053,"https://www.scopus.com/inward/record.uri?eid=2-s2.0-84904523373&doi=10.1037%2fxlm0000053&partnerID=40&md5=056963e630ef8faa7d52087400b808fc",Erratum,,Scopus,2-s2.0-84904523373
"Xu, C., Wells, E., LeFevre, J.-A., Imbo, I.","Strategic flexibility in computational estimation for Chinese-and Canadian-educated adults",2014,"Journal of Experimental Psychology: Learning Memory and Cognition","40","5",,"1481","1497",,3,10.1037/a0037346,"https://www.scopus.com/inward/record.uri?eid=2-s2.0-84904081870&doi=10.1037%2fa0037346&partnerID=40&md5=048b5d8bdb97bb4b8211b58725c053d8",Article,,Scopus,2-s2.0-84904081870
"Han, X., Becker, S.","One spatial map or many? Spatial coding of connected environments",2014,"Journal of Experimental Psychology: Learning Memory and Cognition","40","2",,"511","531",,6,10.1037/a0035259,"https://www.scopus.com/inward/record.uri?eid=2-s2.0-84894472238&doi=10.1037%2fa0035259&partnerID=40&md5=f7a468a4e6d555af7096186bed55399b",Article,,Scopus,2-s2.0-84894472238
"Jonker, T.R., Levene, M., MacLeod, C.M.","Testing the item-order account of design effects using the production effect",2014,"Journal of Experimental Psychology: Learning Memory and Cognition","40","2",,"441","448",,17,10.1037/a0034977,"https://www.scopus.com/inward/record.uri?eid=2-s2.0-84894459800&doi=10.1037%2fa0034977&partnerID=40&md5=cfeeb92fc1f65609cda792d0399da420",Article,,Scopus,2-s2.0-84894459800
"Besken, M., Mulligan, N.W.","Perceptual fluency, auditory generation, and metamemory: Analyzing the perceptual fluency hypothesis in the auditory modality",2014,"Journal of Experimental Psychology: Learning Memory and Cognition","40","2",,"429","440",,22,10.1037/a0034407,"https://www.scopus.com/inward/record.uri?eid=2-s2.0-84894490371&doi=10.1037%2fa0034407&partnerID=40&md5=8fa90a7fc5cfce3d36e7532098fbc175",Article,,Scopus,2-s2.0-84894490371
"Gagl, B., Hawelka, S., Richlan, F., Schuster, S., Hutzler, F.","Parafoveal preprocessing in reading revisited: Evidence from a novel preview manipulation",2014,"Journal of Experimental Psychology: Learning Memory and Cognition","40","2",,"588","595",,9,10.1037/a0034408,"https://www.scopus.com/inward/record.uri?eid=2-s2.0-84894435741&doi=10.1037%2fa0034408&partnerID=40&md5=78efd9ac2b4528e1a9c2b48a7119d1dd",Article,,Scopus,2-s2.0-84894435741
"Hupbach, A., Sahakyan, L.","Additional boundary condition for list-method directed forgetting: The effect of presentation format",2014,"Journal of Experimental Psychology: Learning Memory and Cognition","40","2",,"596","601",,4,10.1037/a0034978,"https://www.scopus.com/inward/record.uri?eid=2-s2.0-84894457172&doi=10.1037%2fa0034978&partnerID=40&md5=e343ced42ccc4aef450be38121099463",Article,,Scopus,2-s2.0-84894457172
"Alards-Tomalin, D., Leboe-McGowan, J.P., Shaw, J.D.M., Leboe-McGowan, L.C.","The effects of numerical magnitude, size, and color saturation on perceived interval duration",2014,"Journal of Experimental Psychology: Learning Memory and Cognition","40","2",,"555","566",,9,10.1037/a0035031,"https://www.scopus.com/inward/record.uri?eid=2-s2.0-84894456545&doi=10.1037%2fa0035031&partnerID=40&md5=654f26c2d9c7a3f1c14b8ccb11be1596",Article,,Scopus,2-s2.0-84894456545
"Gunraj, D.N., Drumm-Hewitt, A.M., Klin, C.M.","Embodiment during reading: Simulating a story character's linguistic actions",2014,"Journal of Experimental Psychology: Learning Memory and Cognition","40","2",,"364","375",,6,10.1037/a0034853,"https://www.scopus.com/inward/record.uri?eid=2-s2.0-84894477575&doi=10.1037%2fa0034853&partnerID=40&md5=1429e86d08899e299f311ee8e6112c99",Article,,Scopus,2-s2.0-84894477575
"Coughlan, E.K., Williams, A.M., McRobert, A.P., Ford, P.R.","How experts practice: A novel test of deliberate practice theory",2014,"Journal of Experimental Psychology: Learning Memory and Cognition","40","2",,"449","458",,14,10.1037/a0034302,"https://www.scopus.com/inward/record.uri?eid=2-s2.0-84894418809&doi=10.1037%2fa0034302&partnerID=40&md5=119a2ff887d02ba4facd5e2f1169f8c5",Article,,Scopus,2-s2.0-84894418809
"Fischer, R., Gottschalk, C., Dreisbach, G.","Context-sensitive adjustment of cognitive control in dual-task performance",2014,"Journal of Experimental Psychology: Learning Memory and Cognition","40","2",,"399","416",,23,10.1037/a0034310,"https://www.scopus.com/inward/record.uri?eid=2-s2.0-84894411014&doi=10.1037%2fa0034310&partnerID=40&md5=4f37c7aa8c80c8bcca1cf8acc9ad0f0e",Article,,Scopus,2-s2.0-84894411014
"Buckley, M.G., Smith, A.D., Haselgrove, M.","Shape shifting: Local landmarks interfere with navigation by, and recognition of, global shape",2014,"Journal of Experimental Psychology: Learning Memory and Cognition","40","2",,"492","510",,4,10.1037/a0034901,"https://www.scopus.com/inward/record.uri?eid=2-s2.0-84894487739&doi=10.1037%2fa0034901&partnerID=40&md5=a7b5c3ad334c4cbc93c9360264cb78e2",Article,Open Access,Scopus,2-s2.0-84894487739
"Pelham, S.D., Abrams, L.","Cognitive advantages and disadvantages in early and late bilinguals",2014,"Journal of Experimental Psychology: Learning Memory and Cognition","40","2",,"313","325",,33,10.1037/a0035224,"https://www.scopus.com/inward/record.uri?eid=2-s2.0-84894493698&doi=10.1037%2fa0035224&partnerID=40&md5=50a25bb1f6836c366209ea6d7b603dbe",Article,,Scopus,2-s2.0-84894493698
"Mayr, U., Kleffner-Canucci, K., Kikumoto, A., Redford, M.A.","Control of task sequences: What is the role of language?",2014,"Journal of Experimental Psychology: Learning Memory and Cognition","40","2",,"376","384",,4,10.1037/a0035221,"https://www.scopus.com/inward/record.uri?eid=2-s2.0-84894420659&doi=10.1037%2fa0035221&partnerID=40&md5=c2c62724e2baac95259108dd0353676f",Article,,Scopus,2-s2.0-84894420659
"Kukona, A., Cho, P.W., Magnuson, J.S., Tabor, W.","Lexical interference effects in sentence processing: Evidence from the visual world paradigm and self-organizing models",2014,"Journal of Experimental Psychology: Learning Memory and Cognition","40","2",,"326","347",,6,10.1037/a0034903,"https://www.scopus.com/inward/record.uri?eid=2-s2.0-84894459618&doi=10.1037%2fa0034903&partnerID=40&md5=ca8d217a26658c490951086bf79db918",Article,,Scopus,2-s2.0-84894459618
"Tooley, K.M., Konopka, A.E., Watson, D.G.","Can intonational phrase structure be primed (like syntactic structure)?",2014,"Journal of Experimental Psychology: Learning Memory and Cognition","40","2",,"348","363",,2,10.1037/a0034900,"https://www.scopus.com/inward/record.uri?eid=2-s2.0-84894475765&doi=10.1037%2fa0034900&partnerID=40&md5=749697139c4be772108b38a753af3fdb",Article,,Scopus,2-s2.0-84894475765
"Bugg, J.M.","Conflict-triggered top-down control: Default mode, last resort, or no such thing?",2014,"Journal of Experimental Psychology: Learning Memory and Cognition","40","2",,"567","587",,30,10.1037/a0035032,"https://www.scopus.com/inward/record.uri?eid=2-s2.0-84894454997&doi=10.1037%2fa0035032&partnerID=40&md5=45728d91d1bd25ca99d5ddf32b4d1b8f",Article,,Scopus,2-s2.0-84894454997
"Patrick, J., Ahmed, A.","Facilitating representation change in insight problems through training",2014,"Journal of Experimental Psychology: Learning Memory and Cognition","40","2",,"532","543",,7,10.1037/a0034304,"https://www.scopus.com/inward/record.uri?eid=2-s2.0-84894494554&doi=10.1037%2fa0034304&partnerID=40&md5=2013bc884d9afe2a4fefc684a5bf2636",Article,,Scopus,2-s2.0-84894494554
"Ricker, T.J., Cowan, N.","Differences between presentation methods in working memory procedures: A matter of working memory consolidation",2014,"Journal of Experimental Psychology: Learning Memory and Cognition","40","2",,"417","428",,31,10.1037/a0034301,"https://www.scopus.com/inward/record.uri?eid=2-s2.0-84894473173&doi=10.1037%2fa0034301&partnerID=40&md5=256cafc50f379809fa5bb3eb676a8db5",Article,,Scopus,2-s2.0-84894473173
"Mou, W., Nankoo, J.-F., Zhou, R., Spetch, M.L.","Use of geometric properties of landmark arrays for reorientation relative to remote cities and local objects",2014,"Journal of Experimental Psychology: Learning Memory and Cognition","40","2",,"476","491",,1,10.1037/a0034976,"https://www.scopus.com/inward/record.uri?eid=2-s2.0-84894443479&doi=10.1037%2fa0034976&partnerID=40&md5=574bd3bdc09c4e85201656f094c2a7ac",Article,,Scopus,2-s2.0-84894443479
"Pennycook, G., Trippas, D., Handley, S.J., Thompson, V.A.","Base rates: Both neglected and intuitive",2014,"Journal of Experimental Psychology: Learning Memory and Cognition","40","2",,"544","554",,31,10.1037/a0034887,"https://www.scopus.com/inward/record.uri?eid=2-s2.0-84894442021&doi=10.1037%2fa0034887&partnerID=40&md5=a2e621ccfe5d27972f160647618c808a",Article,,Scopus,2-s2.0-84894442021
