Authors,Title,Year,Source title,Volume,Issue,Art. No.,Page start,Page end,Page count,Cited by,DOI,Link,Document Type,Access Type,Source,EID
"Feiler, D.C., Kleinbaum, A.M.","Popularity, Similarity, and the Network Extraversion Bias",2015,"Psychological Science","26","5",,"593","603",,10,10.1177/0956797615569580,"https://www.scopus.com/inward/record.uri?eid=2-s2.0-84930579937&doi=10.1177%2f0956797615569580&partnerID=40&md5=63a7bebc5daee782cef4fdaa440613ed",Article,,Scopus,2-s2.0-84930579937
"Sutin, A.R., Terracciano, A.","Body Weight Misperception in Adolescence and Incident Obesity in Young Adulthood",2015,"Psychological Science","26","4",,"507","511",,21,10.1177/0956797614566319,"https://www.scopus.com/inward/record.uri?eid=2-s2.0-84927636868&doi=10.1177%2f0956797614566319&partnerID=40&md5=6651eddba7d0e696998dc284ee670eed",Article,,Scopus,2-s2.0-84927636868
"Lewis, N.A., Oyserman, D.","When Does the Future Begin? Time Metrics Matter, Connecting Present and Future Selves",2015,"Psychological Science","26","6",,"816","825",,11,10.1177/0956797615572231,"https://www.scopus.com/inward/record.uri?eid=2-s2.0-84930518955&doi=10.1177%2f0956797615572231&partnerID=40&md5=33dbd71743646051c5c9eece690e581b",Article,,Scopus,2-s2.0-84930518955
"Rahnev, D., Koizumi, A., McCurdy, L.Y., D’Esposito, M., Lau, H.","Confidence Leak in Perceptual Decision Making",2015,"Psychological Science","26","11",,"1664","1680",,10,10.1177/0956797615595037,"https://www.scopus.com/inward/record.uri?eid=2-s2.0-84946397380&doi=10.1177%2f0956797615595037&partnerID=40&md5=1891d6ef0360f3d16e77372898767c1e",Article,,Scopus,2-s2.0-84946397380
"Kitayama, S., Park, J., Boylan, J.M., Miyamoto, Y., Levine, C.S., Markus, H.R., Karasawa, M., Coe, C.L., Kawakami, N., Love, G.D., Ryff, C.D.","Expression of Anger and Ill Health in Two Cultures: An Examination of Inflammation and Cardiovascular Risk",2015,"Psychological Science","26","2",,"211","220",,26,10.1177/0956797614561268,"https://www.scopus.com/inward/record.uri?eid=2-s2.0-84922690329&doi=10.1177%2f0956797614561268&partnerID=40&md5=6840d064b2bb149c014cce8e1e6568e5",Article,,Scopus,2-s2.0-84922690329
"Kang, M.-S., Choi, J.","Retrieval-Induced Inhibition in Short-Term Memory",2015,"Psychological Science","26","7",,"1014","1025",,3,10.1177/0956797615577358,"https://www.scopus.com/inward/record.uri?eid=2-s2.0-84936989654&doi=10.1177%2f0956797615577358&partnerID=40&md5=6a8176330046cfca35e908f35cec0e71",Article,,Scopus,2-s2.0-84936989654
"Fletcher, J.","Does Entering Adulthood in a Recession Affect Narcissism? Robust Evidence Is Still Needed",2015,"Psychological Science","26","4",,"534","536",,5,10.1177/0956797614558719,"https://www.scopus.com/inward/record.uri?eid=2-s2.0-84927586292&doi=10.1177%2f0956797614558719&partnerID=40&md5=20327c0452654cb900b248a6af70fbf7",Article,,Scopus,2-s2.0-84927586292
"Woumans, E., Martin, C.D., Bulcke, C.V., Van Assche, E., Costa, A., Hartsuiker, R.J., Duyck, W.","Can faces prime a language?",2015,"Psychological Science","26","9",,"1343","1352",,4,10.1177/0956797615589330,"https://www.scopus.com/inward/record.uri?eid=2-s2.0-84957553497&doi=10.1177%2f0956797615589330&partnerID=40&md5=29d9d9a3ffeb7e00033c69d9f1ba13e5",Article,,Scopus,2-s2.0-84957553497
"Jepma, M., Wager, T.D.","Conceptual Conditioning: Mechanisms Mediating Conditioning Effects on Pain",2015,"Psychological Science","26","11",,"1728","1739",,10,10.1177/0956797615597658,"https://www.scopus.com/inward/record.uri?eid=2-s2.0-84945338855&doi=10.1177%2f0956797615597658&partnerID=40&md5=933f5699a9d7b489e11e31bdff40187b",Article,,Scopus,2-s2.0-84945338855
"Denny, B.T., Inhoff, M.C., Zerubavel, N., Davachi, L., Ochsner, K.N.","Getting over it: Long-lasting effects of emotion regulation on amygdala response",2015,"Psychological Science","26","9",,"1377","1388",,14,10.1177/0956797615578863,"https://www.scopus.com/inward/record.uri?eid=2-s2.0-84957553144&doi=10.1177%2f0956797615578863&partnerID=40&md5=453d73d17a1d90077382f912a7e27dd6",Article,,Scopus,2-s2.0-84957553144
"Duñabeitia, J.A., Lallier, M., Paz-Alonso, P.M., Carreiras, M.","The Impact of Literacy on Position Uncertainty",2015,"Psychological Science","26","4",,"548","550",,5,10.1177/0956797615569890,"https://www.scopus.com/inward/record.uri?eid=2-s2.0-84927629209&doi=10.1177%2f0956797615569890&partnerID=40&md5=5d70a5f1b5c35190e887d48abd22c3ea",Article,,Scopus,2-s2.0-84927629209
"Brandt, M.J., Evans, A.M., Crawford, J.T.","The Unthinking or Confident Extremist? Political Extremists Are More Likely Than Moderates to Reject Experimenter-Generated Anchors",2015,"Psychological Science","26","2",,"189","202",,16,10.1177/0956797614559730,"https://www.scopus.com/inward/record.uri?eid=2-s2.0-84922703557&doi=10.1177%2f0956797614559730&partnerID=40&md5=e98d366be6311399616d6c8d5a2bf9fe",Article,,Scopus,2-s2.0-84922703557
"Chen, J., Sperandio, I., Goodale, M.A.","Differences in the Effects of Crowding on Size Perception and Grip Scaling in Densely Cluttered 3-D Scenes",2015,"Psychological Science","26","1",,"58","69",,6,10.1177/0956797614556776,"https://www.scopus.com/inward/record.uri?eid=2-s2.0-84921019930&doi=10.1177%2f0956797614556776&partnerID=40&md5=87bb000df247aa20b2daae427e121d45",Article,,Scopus,2-s2.0-84921019930
"Hickok, G., Farahbod, H., Saberi, K.","The Rhythm of Perception: Entrainment to Acoustic Rhythms Induces Subsequent Perceptual Oscillation",2015,"Psychological Science","26","7",,"1006","1013",,26,10.1177/0956797615576533,"https://www.scopus.com/inward/record.uri?eid=2-s2.0-84936993029&doi=10.1177%2f0956797615576533&partnerID=40&md5=86f035659673955c5638d2e387203f2f",Article,,Scopus,2-s2.0-84936993029
[No author name available],"Erratum to: Corrigendum: Life Paths and Accomplishments of Mathematically Precocious Males and Females Four Decades Later",2015,"Psychological Science","26","4",,"552","553",,,10.1177/0956797615575525,"https://www.scopus.com/inward/record.uri?eid=2-s2.0-84927631783&doi=10.1177%2f0956797615575525&partnerID=40&md5=ac7098f0a95f64fc3b144bfb33f9a29c",Erratum,,Scopus,2-s2.0-84927631783
[No author name available],"Erratum to Fewer things, lasting longer: The effects of emotion on quantity judgments (Psychological Science, (2013), 24, (1057-1059), 10.1177/0956797612465294)",2015,"Psychological Science","26","1",,"108","",,,10.1177/0956797614566124,"https://www.scopus.com/inward/record.uri?eid=2-s2.0-84921064700&doi=10.1177%2f0956797614566124&partnerID=40&md5=271e1e7ee1c931f8e5732033275b0a6c",Erratum,,Scopus,2-s2.0-84921064700
"Hertel, P.T., Hayes, J.A.","Distracted by Cues for Suppressed Memories",2015,"Psychological Science","26","6",,"775","783",,2,10.1177/0956797615570711,"https://www.scopus.com/inward/record.uri?eid=2-s2.0-84930509431&doi=10.1177%2f0956797615570711&partnerID=40&md5=79b36bed0f84673b7b31f15de1c6ff87",Article,,Scopus,2-s2.0-84930509431
"Almeida, J., He, D., Chen, Q., Mahon, B.Z., Zhang, F., Gonçalves, Ó.F., Fang, F., Bi, Y.","Decoding Visual Location From Neural Patterns in the Auditory Cortex of the Congenitally Deaf",2015,"Psychological Science","26","11",,"1771","1782",,5,10.1177/0956797615598970,"https://www.scopus.com/inward/record.uri?eid=2-s2.0-84946417300&doi=10.1177%2f0956797615598970&partnerID=40&md5=d1feaee0b96c501cfdf7f705a24cba71",Article,,Scopus,2-s2.0-84946417300
"Song, J.-H., Bédard, P.","Paradoxical Benefits of Dual-Task Contexts for Visuomotor Memory",2015,"Psychological Science","26","2",,"148","158",,6,10.1177/0956797614557868,"https://www.scopus.com/inward/record.uri?eid=2-s2.0-84922712329&doi=10.1177%2f0956797614557868&partnerID=40&md5=e15499e6015fc249288a96e04620b13a",Article,,Scopus,2-s2.0-84922712329
"Maloney, E.A., Ramirez, G., Gunderson, E.A., Levine, S.C., Beilock, S.L.","Intergenerational effects of parents’ math anxiety on children’s math achievement and anxiety",2015,"Psychological Science","26","9",,"1480","1488",,28,10.1177/0956797615592630,"https://www.scopus.com/inward/record.uri?eid=2-s2.0-84943596739&doi=10.1177%2f0956797615592630&partnerID=40&md5=563538ffe5f9fcac7bee7ec5047c6975",Article,,Scopus,2-s2.0-84943596739
"Xu, Y., Franconeri, S.L.","Capacity for Visual Features in Mental Rotation",2015,"Psychological Science","26","8",,"1241","1251",,7,10.1177/0956797615585002,"https://www.scopus.com/inward/record.uri?eid=2-s2.0-84938585280&doi=10.1177%2f0956797615585002&partnerID=40&md5=5bbfa49fa0f74cc00b4b4b899a7283c4",Article,,Scopus,2-s2.0-84938585280
"Grossmann, I., Varnum, M.E.W.","Social Structure, Infectious Diseases, Disasters, Secularism, and Cultural Change in America",2015,"Psychological Science","26","3",,"311","324",,39,10.1177/0956797614563765,"https://www.scopus.com/inward/record.uri?eid=2-s2.0-84924903171&doi=10.1177%2f0956797614563765&partnerID=40&md5=c8d9113d6f4a9d8b2dc052abd473e24e",Article,,Scopus,2-s2.0-84924903171
"Snefjella, B., Kuperman, V.","Concreteness and psychological distance in natural language use",2015,"Psychological Science","26","9",,"1449","1460",,8,10.1177/0956797615591771,"https://www.scopus.com/inward/record.uri?eid=2-s2.0-84957586151&doi=10.1177%2f0956797615591771&partnerID=40&md5=f52271629f042f92ee39db2908163ca6",Article,,Scopus,2-s2.0-84957586151
"Fukuda, K., Woodman, G.F.","Predicting and Improving Recognition Memory Using Multiple Electrophysiological Signals in Real Time",2015,"Psychological Science","26","7",,"1026","1037",,2,10.1177/0956797615578122,"https://www.scopus.com/inward/record.uri?eid=2-s2.0-84937019712&doi=10.1177%2f0956797615578122&partnerID=40&md5=c42cfea5909d3cf8c489574f0348e2cb",Article,,Scopus,2-s2.0-84937019712
"Cook, R., Aichelburg, C., Johnston, A.","Illusory Feature Slowing: Evidence for Perceptual Models of Global Facial Change",2015,"Psychological Science","26","4",,"512","517",,5,10.1177/0956797614567340,"https://www.scopus.com/inward/record.uri?eid=2-s2.0-84927640698&doi=10.1177%2f0956797614567340&partnerID=40&md5=c9c60f602540ec45bfc99b5fdc12c81d",Article,,Scopus,2-s2.0-84927640698
"Hirsh-Pasek, K., Adamson, L.B., Bakeman, R., Owen, M.T., Golinkoff, R.M., Pace, A., Yust, P.K.S., Suma, K.","The Contribution of Early Communication Quality to Low-Income Children’s Language Success",2015,"Psychological Science","26","7",,"1071","1083",,55,10.1177/0956797615581493,"https://www.scopus.com/inward/record.uri?eid=2-s2.0-84936995512&doi=10.1177%2f0956797615581493&partnerID=40&md5=9c4b1477ed387f5fb2a9e1f0af64cdee",Article,,Scopus,2-s2.0-84936995512
"Buckingham, G., Milne, J.L., Byrne, C.M., Goodale, M.A.","The Size-Weight Illusion Induced Through Human Echolocation",2015,"Psychological Science","26","2",,"237","242",,8,10.1177/0956797614561267,"https://www.scopus.com/inward/record.uri?eid=2-s2.0-84922737806&doi=10.1177%2f0956797614561267&partnerID=40&md5=ea2eb7ad5c9da99db4f6d715b007db82",Article,,Scopus,2-s2.0-84922737806
"DeLoss, D.J., Watanabe, T., Andersen, G.J.","Improving Vision Among Older Adults: Behavioral Training to Improve Sight",2015,"Psychological Science","26","4",,"456","466",,7,10.1177/0956797614567510,"https://www.scopus.com/inward/record.uri?eid=2-s2.0-84927656517&doi=10.1177%2f0956797614567510&partnerID=40&md5=6461ab1ef4a9b7d57890ec9cae256d51",Article,,Scopus,2-s2.0-84927656517
"Bartz, J.A., Lydon, J.E., Kolevzon, A., Zaki, J., Hollander, E., Ludwig, N., Bolger, N.","Differential Effects of Oxytocin on Agency and Communion for Anxiously and Avoidantly Attached Individuals",2015,"Psychological Science","26","8",,"1177","1186",,18,10.1177/0956797615580279,"https://www.scopus.com/inward/record.uri?eid=2-s2.0-84938571911&doi=10.1177%2f0956797615580279&partnerID=40&md5=c12cc3f305d1ce51d42d7529a69a7bed",Article,,Scopus,2-s2.0-84938571911
"Dawtry, R.J., Sutton, R.M., Sibley, C.G.","Why wealthier people think people are wealthier, and why it matters: From social sampling to attitudes to redistribution",2015,"Psychological Science","26","9",,"1389","1400",,12,10.1177/0956797615586560,"https://www.scopus.com/inward/record.uri?eid=2-s2.0-84951150724&doi=10.1177%2f0956797615586560&partnerID=40&md5=c5dfb868c6fcef6365ebaa58fc24f17d",Article,,Scopus,2-s2.0-84951150724
"Birmingham, E., Stanley, D., Nair, R., Adolphs, R.","Implicit Social Biases in People With Autism",2015,"Psychological Science","26","11",,"1693","1705",,2,10.1177/0956797615595607,"https://www.scopus.com/inward/record.uri?eid=2-s2.0-84946407418&doi=10.1177%2f0956797615595607&partnerID=40&md5=01cf296165c07c99b4f33375161c2b3e",Article,,Scopus,2-s2.0-84946407418
"Daly, M., Delaney, L., Egan, M., Baumeister, R.F.","Childhood Self-Control and Unemployment Throughout the Life Span: Evidence From Two British Cohort Studies",2015,"Psychological Science","26","6",,"709","723",,33,10.1177/0956797615569001,"https://www.scopus.com/inward/record.uri?eid=2-s2.0-84930519660&doi=10.1177%2f0956797615569001&partnerID=40&md5=313f1de42d61bf8318cebf9c950a2f2e",Article,,Scopus,2-s2.0-84930519660
"Franz, V.H., von Luxburg, U.","No Evidence for Unconscious Lie Detection: A Significant Difference Does Not Imply Accurate Classification",2015,"Psychological Science","26","10",,"1646","1648",,10,10.1177/0956797615597333,"https://www.scopus.com/inward/record.uri?eid=2-s2.0-84944456798&doi=10.1177%2f0956797615597333&partnerID=40&md5=90f0c9e767ba98bdb1158dfd003d7a7f",Article,,Scopus,2-s2.0-84944456798
"Shah, A.K., Shafir, E., Mullainathan, S.","Scarcity Frames Value",2015,"Psychological Science","26","4",,"402","412",,26,10.1177/0956797614563958,"https://www.scopus.com/inward/record.uri?eid=2-s2.0-84927602216&doi=10.1177%2f0956797614563958&partnerID=40&md5=946c60bf199ba7aed6f7cfb539d31a32",Article,,Scopus,2-s2.0-84927602216
"Phillips, J., Ong, D.C., Surtees, A.D.R., Xin, Y., Williams, S., Saxe, R., Frank, M.C.","A second look at automatic theory of mind: Reconsidering kovács, téglás, and endress (2010)",2015,"Psychological Science","26","9",,"1353","1367",,12,10.1177/0956797614558717,"https://www.scopus.com/inward/record.uri?eid=2-s2.0-84957536389&doi=10.1177%2f0956797614558717&partnerID=40&md5=81458a9947f87f8353872ea078e56301",Article,,Scopus,2-s2.0-84957536389
"Hartshorne, J.K., Germine, L.T.","When Does Cognitive Functioning Peak? The Asynchronous Rise and Fall of Different Cognitive Abilities Across the Life Span",2015,"Psychological Science","26","4",,"433","443",,64,10.1177/0956797614567339,"https://www.scopus.com/inward/record.uri?eid=2-s2.0-84927629360&doi=10.1177%2f0956797614567339&partnerID=40&md5=44d4ecbdfbb504c323ecfb653f958331",Article,,Scopus,2-s2.0-84927629360
"Duffy, K.A., Chartrand, T.L.","The Extravert Advantage: How and When Extraverts Build Rapport With Other People",2015,"Psychological Science","26","11",,"1795","1802",,6,10.1177/0956797615600890,"https://www.scopus.com/inward/record.uri?eid=2-s2.0-84946411560&doi=10.1177%2f0956797615600890&partnerID=40&md5=ee3c645aa04b1bb153c76fdd68be4591",Article,,Scopus,2-s2.0-84946411560
"Gendron, M., Roberson, D., Barrett, L.F.","Cultural Variation in Emotion Perception Is Real: A Response to Sauter, Eisner, Ekman, and Scott (2015)",2015,"Psychological Science","26","3",,"357","359",,6,10.1177/0956797614566659,"https://www.scopus.com/inward/record.uri?eid=2-s2.0-84924855168&doi=10.1177%2f0956797614566659&partnerID=40&md5=5a1ae882e6076593ff038c8df07cb66b",Note,,Scopus,2-s2.0-84924855168
"Scopelliti, I., Loewenstein, G., Vosgerau, J.","You Call It “Self-Exuberance”; I Call It “Bragging”: Miscalibrated Predictions of Emotional Responses to Self-Promotion",2015,"Psychological Science","26","6",,"903","914",,4,10.1177/0956797615573516,"https://www.scopus.com/inward/record.uri?eid=2-s2.0-84930513543&doi=10.1177%2f0956797615573516&partnerID=40&md5=78670b41a27c3c0087a3e875d99343d3",Article,,Scopus,2-s2.0-84930513543
"Sofer, C., Dotsch, R., Wigboldus, D.H.J., Todorov, A.","What Is Typical Is Good: The Influence of Face Typicality on Perceived Trustworthiness",2015,"Psychological Science","26","1",,"39","47",,19,10.1177/0956797614554955,"https://www.scopus.com/inward/record.uri?eid=2-s2.0-84921058992&doi=10.1177%2f0956797614554955&partnerID=40&md5=a6cea7d9d9426af5918e37c8f5ec550e",Article,,Scopus,2-s2.0-84921058992
"Sokol-Hessner, P., Lackovic, S.F., Tobe, R.H., Camerer, C.F., Leventhal, B.L., Phelps, E.A.","Determinants of Propranolol’s Selective Effect on Loss Aversion",2015,"Psychological Science","26","7",,"1123","1130",,10,10.1177/0956797615582026,"https://www.scopus.com/inward/record.uri?eid=2-s2.0-84937019972&doi=10.1177%2f0956797615582026&partnerID=40&md5=a2ce071f4e179e3f55367189c3675492",Article,,Scopus,2-s2.0-84937019972
"Van Zant, A.B., Moore, D.A.","Leaders’ Use of Moral Justifications Increases Policy Support",2015,"Psychological Science","26","6",,"934","943",,6,10.1177/0956797615572909,"https://www.scopus.com/inward/record.uri?eid=2-s2.0-84930520858&doi=10.1177%2f0956797615572909&partnerID=40&md5=e60e84f381199c621d53298340706627",Article,,Scopus,2-s2.0-84930520858
"Jirout, J.J., Newcombe, N.S.","Building Blocks for Developing Spatial Skills: Evidence From a Large, Representative U.S. Sample",2015,"Psychological Science","26","3",,"302","310",,26,10.1177/0956797614563338,"https://www.scopus.com/inward/record.uri?eid=2-s2.0-84924853893&doi=10.1177%2f0956797614563338&partnerID=40&md5=ce94487cc7c6c5a6e7185d44780b0e85",Article,,Scopus,2-s2.0-84924853893
"Atir, S., Rosenzweig, E., Dunning, D.","When Knowledge Knows No Bounds: Self-Perceived Expertise Predicts Claims of Impossible Knowledge",2015,"Psychological Science","26","8",,"1295","1303",,16,10.1177/0956797615588195,"https://www.scopus.com/inward/record.uri?eid=2-s2.0-84938570543&doi=10.1177%2f0956797615588195&partnerID=40&md5=0257332c3d996c567d8fc1f2398e6c70",Article,,Scopus,2-s2.0-84938570543
"Petersen, M.B., Aarøe, L.","Birth Weight and Social Trust in Adulthood: Evidence for Early Calibration of Social Cognition",2015,"Psychological Science","26","11",,"1681","1692",,6,10.1177/0956797615595622,"https://www.scopus.com/inward/record.uri?eid=2-s2.0-84946411808&doi=10.1177%2f0956797615595622&partnerID=40&md5=4f60a1cfb68ae9d484dddd33d7387f22",Article,,Scopus,2-s2.0-84946411808
"John-Henderson, N.A., Stellar, J.E., Mendoza-Denton, R., Francis, D.D.","Socioeconomic Status and Social Support: Social Support Reduces Inflammatory Reactivity for Individuals Whose Early-Life Socioeconomic Status Was Low",2015,"Psychological Science","26","10",,"1620","1629",,7,10.1177/0956797615595962,"https://www.scopus.com/inward/record.uri?eid=2-s2.0-84939424262&doi=10.1177%2f0956797615595962&partnerID=40&md5=e57b9f9be44a686eb64a47f8bba8fd51",Article,,Scopus,2-s2.0-84939424262
"Boehm, J.K., Winning, A., Segerstrom, S., Kubzansky, L.D.","Variability Modifies Life Satisfaction’s Association With Mortality Risk in Older Adults",2015,"Psychological Science","26","7",,"1063","1070",,6,10.1177/0956797615581491,"https://www.scopus.com/inward/record.uri?eid=2-s2.0-84936998675&doi=10.1177%2f0956797615581491&partnerID=40&md5=43aaf3cfcd963e0e99e499385e2bd29e",Article,,Scopus,2-s2.0-84936998675
"Biggs, A.T., Cain, M.S., Mitroff, S.R.","Cognitive Training Can Reduce Civilian Casualties in a Simulated Shooting Environment",2015,"Psychological Science","26","8",,"1164","1176",,4,10.1177/0956797615579274,"https://www.scopus.com/inward/record.uri?eid=2-s2.0-84938566724&doi=10.1177%2f0956797615579274&partnerID=40&md5=4179a105cf23708c73c19b65530e3a5a",Article,,Scopus,2-s2.0-84938566724
"Moskowitz, G.B., Olcaysoy Okten, I., Gooch, C.M.","On Race and Time",2015,"Psychological Science","26","11",,"1783","1794",,6,10.1177/0956797615599547,"https://www.scopus.com/inward/record.uri?eid=2-s2.0-84946405346&doi=10.1177%2f0956797615599547&partnerID=40&md5=0ee0c0fc491fb973c634f840b37450f6",Article,,Scopus,2-s2.0-84946405346
"Madore, K.P., Addis, D.R., Schacter, D.L.","Creativity and memory: Effects of an episodic-specificity induction on divergent thinking",2015,"Psychological Science","26","9",,"1461","1468",,26,10.1177/0956797615591863,"https://www.scopus.com/inward/record.uri?eid=2-s2.0-84953724702&doi=10.1177%2f0956797615591863&partnerID=40&md5=57dd75db745da45180625173f3037eec",Article,,Scopus,2-s2.0-84953724702
"James, E.L., Bonsall, M.B., Hoppitt, L., Tunbridge, E.M., Geddes, J.R., Milton, A.L., Holmes, E.A.","Computer Game Play Reduces Intrusive Memories of Experimental Trauma via Reconsolidation-Update Mechanisms",2015,"Psychological Science","26","8",,"1201","1215",,37,10.1177/0956797615583071,"https://www.scopus.com/inward/record.uri?eid=2-s2.0-84938591546&doi=10.1177%2f0956797615583071&partnerID=40&md5=91232e3e8f1598ee3a7e8a0b418f611b",Article,,Scopus,2-s2.0-84938591546
"Wilson, J.P., Rule, N.O.","Facial Trustworthiness Predicts Extreme Criminal-Sentencing Outcomes",2015,"Psychological Science","26","8",,"1325","1331",,34,10.1177/0956797615590992,"https://www.scopus.com/inward/record.uri?eid=2-s2.0-84938632543&doi=10.1177%2f0956797615590992&partnerID=40&md5=b43c6649287c031e75edd51d3915fc4e",Article,,Scopus,2-s2.0-84938632543
"Murphy, M.L.M., Slavich, G.M., Chen, E., Miller, G.E.","Targeted Rejection Predicts Decreased Anti-Inflammatory Gene Expression and Increased Symptom Severity in Youth With Asthma",2015,"Psychological Science","26","2",,"111","121",,7,10.1177/0956797614556320,"https://www.scopus.com/inward/record.uri?eid=2-s2.0-84922721933&doi=10.1177%2f0956797614556320&partnerID=40&md5=08c7c189430de6536f1b3c68bc301921",Article,,Scopus,2-s2.0-84922721933
[No author name available],"Retraction of “Sadness Impairs Color Perception” (Psychological Science, 10.1177/0956797615597672)",2015,"Psychological Science","26","11",,"1822","",,,10.1177/0956797615597672,"https://www.scopus.com/inward/record.uri?eid=2-s2.0-84946410267&doi=10.1177%2f0956797615597672&partnerID=40&md5=90279e5bc53ecddd4ea899043272e311",Erratum,,Scopus,2-s2.0-84946410267
"Storm, B.C., Stone, S.M.","Saving-Enhanced Memory: The Benefits of Saving on the Learning and Remembering of New Information",2015,"Psychological Science","26","2",,"182","188",,10,10.1177/0956797614559285,"https://www.scopus.com/inward/record.uri?eid=2-s2.0-84922720349&doi=10.1177%2f0956797614559285&partnerID=40&md5=ab259caba1640ed7c5240d5ece1052fd",Article,,Scopus,2-s2.0-84922720349
"Durso, G.R.O., Luttrell, A., Way, B.M.","Over-the-Counter Relief From Pains and Pleasures Alike: Acetaminophen Blunts Evaluation Sensitivity to Both Negative and Positive Stimuli",2015,"Psychological Science","26","6",,"750","758",,11,10.1177/0956797615570366,"https://www.scopus.com/inward/record.uri?eid=2-s2.0-84930516197&doi=10.1177%2f0956797615570366&partnerID=40&md5=daedbb1d562833943dcbd1e5f6621ff9",Article,,Scopus,2-s2.0-84930516197
"Yin, L., McBride, C.","Chinese Kindergartners Learn to Read Characters Analytically",2015,"Psychological Science","26","4",,"424","432",,9,10.1177/0956797614567203,"https://www.scopus.com/inward/record.uri?eid=2-s2.0-84927631680&doi=10.1177%2f0956797614567203&partnerID=40&md5=4dc104e4f82e1ba658e4987e96f7d851",Article,,Scopus,2-s2.0-84927631680
"Sutin, A.R., Stephan, Y., Terracciano, A.","Weight Discrimination and Risk of Mortality",2015,"Psychological Science","26","11",,"1803","1811",,31,10.1177/0956797615601103,"https://www.scopus.com/inward/record.uri?eid=2-s2.0-84946404406&doi=10.1177%2f0956797615601103&partnerID=40&md5=947cb08f83ef5bff15804ee6411f9c51",Article,,Scopus,2-s2.0-84946404406
"Sullivan, N., Hutcherson, C., Harris, A., Rangel, A.","Dietary Self-Control Is Related to the Speed With Which Attributes of Healthfulness and Tastiness Are Processed",2015,"Psychological Science","26","2",,"122","134",,22,10.1177/0956797614559543,"https://www.scopus.com/inward/record.uri?eid=2-s2.0-84922689241&doi=10.1177%2f0956797614559543&partnerID=40&md5=92af85644b9684eaf68d641d0bbacee8",Article,,Scopus,2-s2.0-84922689241
"Okonofua, J.A., Eberhardt, J.L.","Two Strikes: Race and the Disciplining of Young Students",2015,"Psychological Science","26","5",,"617","624",,39,10.1177/0956797615570365,"https://www.scopus.com/inward/record.uri?eid=2-s2.0-84930591543&doi=10.1177%2f0956797615570365&partnerID=40&md5=8bc029327e287bcd97f53e3afbd25575",Article,,Scopus,2-s2.0-84930591543
"Chambers, J.R., Swan, L.K., Heesacker, M.","Perceptions of U.S. Social Mobility Are Divided (and Distorted) Along Ideological Lines",2015,"Psychological Science","26","4",,"413","423",,10,10.1177/0956797614566657,"https://www.scopus.com/inward/record.uri?eid=2-s2.0-84927671243&doi=10.1177%2f0956797614566657&partnerID=40&md5=1445ee0bcd0962b0fe5de0333c48b692",Article,,Scopus,2-s2.0-84927671243
"Schäfer, M., Haun, D.B.M., Tomasello, M.","Fair Is Not Fair Everywhere",2015,"Psychological Science","26","8",,"1252","1260",,24,10.1177/0956797615586188,"https://www.scopus.com/inward/record.uri?eid=2-s2.0-84938564573&doi=10.1177%2f0956797615586188&partnerID=40&md5=ec68a700a5d968aae12a628137003cdf",Article,,Scopus,2-s2.0-84938564573
"Bianchi, E.C.","Assessing the Robustness of the Relationship Between Entering Adulthood in a Recession and Narcissism",2015,"Psychological Science","26","4",,"537","538",,3,10.1177/0956797614568157,"https://www.scopus.com/inward/record.uri?eid=2-s2.0-84927640063&doi=10.1177%2f0956797614568157&partnerID=40&md5=34ab43669f7711f7be079598a506f22c",Article,,Scopus,2-s2.0-84927640063
"Na, J., Kim, S., Oh, H., Choi, I., O’Toole, A.","Competence Judgments Based on Facial Appearance Are Better Predictors of American Elections Than of Korean Elections",2015,"Psychological Science","26","7",,"1107","1113",,6,10.1177/0956797615576489,"https://www.scopus.com/inward/record.uri?eid=2-s2.0-84937019715&doi=10.1177%2f0956797615576489&partnerID=40&md5=2fe2545f4618c168ff0f4275f1a4da25",Article,,Scopus,2-s2.0-84937019715
