Authors,Title,Year,Source title,Volume,Issue,Art. No.,Page start,Page end,Page count,Cited by,DOI,Link,Document Type,Access Type,Source,EID
"Galinsky, A.D., Hall, E.V., Cuddy, A.J.C.","Gendered Races: Implications for Interracial Marriage, Leadership Selection, and Athletic Participation",2013,"Psychological Science","24","4",,"498","506",,45,10.1177/0956797612457783,"https://www.scopus.com/inward/record.uri?eid=2-s2.0-84876188624&doi=10.1177%2f0956797612457783&partnerID=40&md5=b4f07cc39e6f12f15d702670c9238ace",Article,,Scopus,2-s2.0-84876188624
"Cook, R., Brewer, R., Shah, P., Bird, G.","Alexithymia, Not Autism, Predicts Poor Recognition of Emotional Facial Expressions",2013,"Psychological Science","24","5",,"723","732",,85,10.1177/0956797612463582,"https://www.scopus.com/inward/record.uri?eid=2-s2.0-84877320495&doi=10.1177%2f0956797612463582&partnerID=40&md5=897d4de916217d5e159910c6d416047f",Article,,Scopus,2-s2.0-84877320495
"Bradford, D.E., Shapiro, B.L., Curtin, J.J.","How Bad Could It Be? Alcohol Dampens Stress Responses to Threat of Uncertain Intensity",2013,"Psychological Science","24","12",,"2541","2549",,27,10.1177/0956797613499923,"https://www.scopus.com/inward/record.uri?eid=2-s2.0-84890337654&doi=10.1177%2f0956797613499923&partnerID=40&md5=d612bf9049929b7e50d3f0037bc74a34",Article,,Scopus,2-s2.0-84890337654
"Galinsky, A.D., Wang, C.S., Whitson, J.A., Anicich, E.M., Hugenberg, K., Bodenhausen, G.V.","The Reappropriation of Stigmatizing Labels: The Reciprocal Relationship Between Power and Self-Labeling",2013,"Psychological Science","24","10",,"2020","2029",,37,10.1177/0956797613482943,"https://www.scopus.com/inward/record.uri?eid=2-s2.0-84885345004&doi=10.1177%2f0956797613482943&partnerID=40&md5=2b01223ad348b726374bc9b315e2300c",Article,,Scopus,2-s2.0-84885345004
"Caravolas, M., Lervåg, A., Defior, S., Seidlová Málková, G., Hulme, C.","Different Patterns, but Equivalent Predictors, of Growth in Reading in Consistent and Inconsistent Orthographies",2013,"Psychological Science","24","8",,"1398","1407",,64,10.1177/0956797612473122,"https://www.scopus.com/inward/record.uri?eid=2-s2.0-84881236756&doi=10.1177%2f0956797612473122&partnerID=40&md5=fc98029e0590c46c30d3a14c8e5a7c82",Article,,Scopus,2-s2.0-84881236756
"Heisz, J.J., Pottruff, M.M., Shore, D.I.","Females Scan More Than Males: A Potential Mechanism for Sex Differences in Recognition Memory",2013,"Psychological Science","24","7",,"1157","1163",,11,10.1177/0956797612468281,"https://www.scopus.com/inward/record.uri?eid=2-s2.0-84880058729&doi=10.1177%2f0956797612468281&partnerID=40&md5=090bb7c59b64e12bbf0e4527583be70b",Article,,Scopus,2-s2.0-84880058729
"Shen, L., Urminsky, O.","Making Sense of Nonsense: The Visual Salience of Units Determines Sensitivity to Magnitude",2013,"Psychological Science","24","3",,"297","304",,5,10.1177/0956797612451470,"https://www.scopus.com/inward/record.uri?eid=2-s2.0-84875036343&doi=10.1177%2f0956797612451470&partnerID=40&md5=e91183b610ab907f20a3ef8143a84b89",Article,,Scopus,2-s2.0-84875036343
"Třebický, V., Havlíček, J., Roberts, S.C., Little, A.C., Kleisner, K.","Perceived Aggressiveness Predicts Fighting Performance in Mixed-Martial-Arts Fighters",2013,"Psychological Science","24","9",,"1664","1672",,28,10.1177/0956797613477117,"https://www.scopus.com/inward/record.uri?eid=2-s2.0-84883782113&doi=10.1177%2f0956797613477117&partnerID=40&md5=a2f7db5acb1e1a88fff27c80b369dbe5",Article,,Scopus,2-s2.0-84883782113
"Yee, E., Chrysikou, E.G., Hoffman, E., Thompson-Schill, S.L.","Manual Experience Shapes Object Representations",2013,"Psychological Science","24","6",,"909","919",,39,10.1177/0956797612464658,"https://www.scopus.com/inward/record.uri?eid=2-s2.0-84878810116&doi=10.1177%2f0956797612464658&partnerID=40&md5=0524f2aa6dd5691edb6afe982b2dee00",Article,,Scopus,2-s2.0-84878810116
"Mannes, A.E., Moore, D.A.","A Behavioral Demonstration of Overconfidence in Judgment",2013,"Psychological Science","24","7",,"1190","1197",,12,10.1177/0956797612470700,"https://www.scopus.com/inward/record.uri?eid=2-s2.0-84880060433&doi=10.1177%2f0956797612470700&partnerID=40&md5=55b7fb66a8afaf92ff10a7205911f986",Article,,Scopus,2-s2.0-84880060433
"Weng, H.Y., Fox, A.S., Shackman, A.J., Stodola, D.E., Caldwell, J.Z.K., Olson, M.C., Rogers, G.M., Davidson, R.J.","Compassion Training Alters Altruism and Neural Responses to Suffering",2013,"Psychological Science","24","7",,"1171","1180",,124,10.1177/0956797612469537,"https://www.scopus.com/inward/record.uri?eid=2-s2.0-84880075872&doi=10.1177%2f0956797612469537&partnerID=40&md5=746058e0a2bd980e2c635862a36cef64",Article,,Scopus,2-s2.0-84880075872
"Jaremka, L.M., Glaser, R., Loving, T.J., Malarkey, W.B., Stowell, J.R., Kiecolt-Glaser, J.K.","Attachment Anxiety Is Linked to Alterations in Cortisol Production and Cellular Immunity",2013,"Psychological Science","24","3",,"272","279",,42,10.1177/0956797612452571,"https://www.scopus.com/inward/record.uri?eid=2-s2.0-84872824848&doi=10.1177%2f0956797612452571&partnerID=40&md5=19703480a5eb54e0da0799d2e9bcc7e9",Article,,Scopus,2-s2.0-84872824848
"Banissy, M.J., Tester, V., Muggleton, N.G., Janik, A.B., Davenport, A., Franklin, A., Walsh, V., Ward, J.","Synesthesia for Color Is Linked to Improved Color Perception but Reduced Motion Perception",2013,"Psychological Science","24","12",,"2390","2397",,17,10.1177/0956797613492424,"https://www.scopus.com/inward/record.uri?eid=2-s2.0-84890325494&doi=10.1177%2f0956797613492424&partnerID=40&md5=b995300a4a1825244d0eb72020e65ca7",Article,,Scopus,2-s2.0-84890325494
"Erickson, K.I., Banducci, S.E., Weinstein, A.M., MacDonald III, A.W., Ferrell, R.E., Halder, I., Flory, J.D., Manuck, S.B.","The Brain-Derived Neurotrophic Factor Val66Met Polymorphism Moderates an Effect of Physical Activity on Working Memory Performance",2013,"Psychological Science","24","9",,"1770","1779",,46,10.1177/0956797613480367,"https://www.scopus.com/inward/record.uri?eid=2-s2.0-84883771291&doi=10.1177%2f0956797613480367&partnerID=40&md5=832025edb3011b5585db697c1b43e42d",Article,,Scopus,2-s2.0-84883771291
"Hehman, E., Leitner, J.B., Deegan, M.P., Gaertner, S.L.","Facial Structure Is Indicative of Explicit Support for Prejudicial Beliefs",2013,"Psychological Science","24","3",,"289","296",,23,10.1177/0956797612451467,"https://www.scopus.com/inward/record.uri?eid=2-s2.0-84875012989&doi=10.1177%2f0956797612451467&partnerID=40&md5=92af48096fe6c58031f9b69591400f60",Article,,Scopus,2-s2.0-84875012989
"Righetti, F., Finkenauer, C., Finkel, E.J.","Low Self-Control Promotes the Willingness to Sacrifice in Close Relationships",2013,"Psychological Science","24","8",,"1533","1540",,37,10.1177/0956797613475457,"https://www.scopus.com/inward/record.uri?eid=2-s2.0-84881239817&doi=10.1177%2f0956797613475457&partnerID=40&md5=282843a782a98097b91cb2edc7664d50",Article,,Scopus,2-s2.0-84881239817
"Beran, M.J., Smith, J.D., Perdue, B.M.","Language-Trained Chimpanzees (Pan troglodytes) Name What They Have Seen but Look First at What They Have Not Seen",2013,"Psychological Science","24","5",,"660","666",,26,10.1177/0956797612458936,"https://www.scopus.com/inward/record.uri?eid=2-s2.0-84877336988&doi=10.1177%2f0956797612458936&partnerID=40&md5=6b131fa7fc9b8e6b09f9ccb05c302cba",Article,,Scopus,2-s2.0-84877336988
"Fessler, D.M.T., Holbrook, C.","Friends Shrink Foes: The Presence of Comrades Decreases the Envisioned Physical Formidability of an Opponent",2013,"Psychological Science","24","5",,"797","802",,37,10.1177/0956797612461508,"https://www.scopus.com/inward/record.uri?eid=2-s2.0-84877343069&doi=10.1177%2f0956797612461508&partnerID=40&md5=281482014fde82b28041e17daf93f0e9",Article,,Scopus,2-s2.0-84877343069
"Overbeck, J.R., Droutman, V.","One for All: Social Power Increases Self-Anchoring of Traits, Attitudes, and Emotions",2013,"Psychological Science","24","8",,"1466","1476",,15,10.1177/0956797612474671,"https://www.scopus.com/inward/record.uri?eid=2-s2.0-84881228817&doi=10.1177%2f0956797612474671&partnerID=40&md5=483d4563f4005cbf18dd46adac570685",Article,,Scopus,2-s2.0-84881228817
"Fernbach, P.M., Rogers, T., Fox, C.R., Sloman, S.A.","Political Extremism Is Supported by an Illusion of Understanding",2013,"Psychological Science","24","6",,"939","946",,59,10.1177/0956797612464058,"https://www.scopus.com/inward/record.uri?eid=2-s2.0-84878794009&doi=10.1177%2f0956797612464058&partnerID=40&md5=54c5b8192b89a50ad03d49719356bbde",Article,,Scopus,2-s2.0-84878794009
"Pierce, J.R., Kilduff, G.J., Galinsky, A.D., Sivanathan, N.","From Glue to Gasoline: How Competition Turns Perspective Takers Unethical",2013,"Psychological Science","24","10",,"1986","1994",,37,10.1177/0956797613482144,"https://www.scopus.com/inward/record.uri?eid=2-s2.0-84885349054&doi=10.1177%2f0956797613482144&partnerID=40&md5=acd6f1b872d7f043b836cdbec3d78d95",Article,,Scopus,2-s2.0-84885349054
"Frost, R., Siegelman, N., Narkiss, A., Afek, L.","What Predicts Successful Literacy Acquisition in a Second Language?",2013,"Psychological Science","24","7",,"1243","1252",,49,10.1177/0956797612472207,"https://www.scopus.com/inward/record.uri?eid=2-s2.0-84880057385&doi=10.1177%2f0956797612472207&partnerID=40&md5=bfadb82a8bd97e9a117e9f2764057244",Article,,Scopus,2-s2.0-84880057385
"Bornstein, M.H., Hahn, C.-S., Suwalsky, J.T.D.","Physically Developed and Exploratory Young Infants Contribute to Their Own Long-Term Academic Achievement",2013,"Psychological Science","24","10",,"1906","1917",,40,10.1177/0956797613479974,"https://www.scopus.com/inward/record.uri?eid=2-s2.0-84885356221&doi=10.1177%2f0956797613479974&partnerID=40&md5=0803d25fe188abbe57555bd1f8ec6422",Article,,Scopus,2-s2.0-84885356221
"Schmiedek, F., Lövdén, M., Lindenberger, U.","Keeping It Steady: Older Adults Perform More Consistently on Cognitive Tasks Than Younger Adults",2013,"Psychological Science","24","9",,"1747","1754",,14,10.1177/0956797613479611,"https://www.scopus.com/inward/record.uri?eid=2-s2.0-84883824688&doi=10.1177%2f0956797613479611&partnerID=40&md5=82124890ce1361e6a416b26eb577a49d",Article,,Scopus,2-s2.0-84883824688
"Shomstein, S., Johnson, J.","Shaping Attention With Reward: Effects of Reward on Space- and Object-Based Selection",2013,"Psychological Science","24","12",,"2369","2378",,26,10.1177/0956797613490743,"https://www.scopus.com/inward/record.uri?eid=2-s2.0-84879311684&doi=10.1177%2f0956797613490743&partnerID=40&md5=f06762149622cbdfc532fb0ad3d5f556",Article,,Scopus,2-s2.0-84879311684
"Cummings, J.N., Kiesler, S., Bosagh Zadeh, R., Balakrishnan, A.D.","Group Heterogeneity Increases the Risks of Large Group Size: A Longitudinal Study of Productivity in Research Groups",2013,"Psychological Science","24","6",,"880","890",,22,10.1177/0956797612463082,"https://www.scopus.com/inward/record.uri?eid=2-s2.0-84878802190&doi=10.1177%2f0956797612463082&partnerID=40&md5=fbd23e223092e36f8af944c8757542dc",Article,,Scopus,2-s2.0-84878802190
"Cole, S., Balcetis, E., Dunning, D.","Affective Signals of Threat Increase Perceived Proximity",2013,"Psychological Science","24","1",,"34","40",,62,10.1177/0956797612446953,"https://www.scopus.com/inward/record.uri?eid=2-s2.0-84872359873&doi=10.1177%2f0956797612446953&partnerID=40&md5=6bb7dc7c65221613dcebb5b3526a6ce2",Article,,Scopus,2-s2.0-84872359873
"Rodeheffer, C.D., Hill, S.E., Lord, C.G.","Erratum to Does This Recession Make Me Look Black? The Effect of Resource Scarcity on the Categorization of Biracial Faces (Psychological Science, (2012), 23, 12, (1476-1478), 10.1177/0956797612450892)",2013,"Psychological Science","24","4",,"600","",,,10.1177/0956797613485224,"https://www.scopus.com/inward/record.uri?eid=2-s2.0-84876168283&doi=10.1177%2f0956797613485224&partnerID=40&md5=f414729607ad19d085730c01537bed04",Erratum,,Scopus,2-s2.0-84876168283
"Silberzahn, R., Uhlmann, E.L.","It Pays to Be Herr Kaiser: Germans With Noble-Sounding Surnames More Often Work as Managers Than as Employees",2013,"Psychological Science","24","12",,"2437","2444",,8,10.1177/0956797613494851,"https://www.scopus.com/inward/record.uri?eid=2-s2.0-84890320622&doi=10.1177%2f0956797613494851&partnerID=40&md5=5cd19fefcd68d79999ef348b20eb1c86",Article,,Scopus,2-s2.0-84890320622
"Otto, A.R., Gershman, S.J., Markman, A.B., Daw, N.D.","The Curse of Planning: Dissecting Multiple Reinforcement-Learning Systems by Taxing the Central Executive",2013,"Psychological Science","24","5",,"751","761",,96,10.1177/0956797612463080,"https://www.scopus.com/inward/record.uri?eid=2-s2.0-84877341847&doi=10.1177%2f0956797612463080&partnerID=40&md5=9a4aa7f9f2e383248b2fe97602013edb",Article,,Scopus,2-s2.0-84877341847
"Laran, J., Salerno, A.","Life-History Strategy, Food Choice, and Caloric Consumption",2013,"Psychological Science","24","2",,"167","173",,24,10.1177/0956797612450033,"https://www.scopus.com/inward/record.uri?eid=2-s2.0-84873541796&doi=10.1177%2f0956797612450033&partnerID=40&md5=1bbf4a39278926750401b79b7e47fc43",Article,,Scopus,2-s2.0-84873541796
"Norman, L.J., Heywood, C.A., Kentridge, R.W.","Object-Based Attention Without Awareness",2013,"Psychological Science","24","6",,"836","843",,30,10.1177/0956797612461449,"https://www.scopus.com/inward/record.uri?eid=2-s2.0-84878781376&doi=10.1177%2f0956797612461449&partnerID=40&md5=de384d61b205035d4cb6eae211d2b8bd",Article,,Scopus,2-s2.0-84878781376
"Nelson, S.K., Kushlev, K., English, T., Dunn, E.W., Lyubomirsky, S.","In Defense of Parenthood: Children Are Associated With More Joy Than Misery",2013,"Psychological Science","24","1",,"3","10",,74,10.1177/0956797612447798,"https://www.scopus.com/inward/record.uri?eid=2-s2.0-84872291862&doi=10.1177%2f0956797612447798&partnerID=40&md5=9f351f0dff17e20087296dc1c5f66bed",Article,,Scopus,2-s2.0-84872291862
"de Brigard, F., Szpunar, K.K., Schacter, D.L.","Coming to Grips With the Past: Effect of Repeated Simulation on the Perceived Plausibility of Episodic Counterfactual Thoughts",2013,"Psychological Science","24","7",,"1329","1334",,23,10.1177/0956797612468163,"https://www.scopus.com/inward/record.uri?eid=2-s2.0-84869846373&doi=10.1177%2f0956797612468163&partnerID=40&md5=92dd2db73350f6d349d75118c4b111bc",Article,,Scopus,2-s2.0-84869846373
"Shalev, I., Moffitt, T.E., Wong, T.Y., Meier, M.H., Houts, R.M., Ding, J., Cheung, C.Y., Ikram, M.K., Caspi, A., Poulton, R.","Retinal Vessel Caliber and Lifelong Neuropsychological Functioning: Retinal Imaging as an Investigative Tool for Cognitive Epidemiology",2013,"Psychological Science","24","7",,"1198","1207",,14,10.1177/0956797612470959,"https://www.scopus.com/inward/record.uri?eid=2-s2.0-84880073622&doi=10.1177%2f0956797612470959&partnerID=40&md5=c3794101c00a8c9fcbea395966ed7684",Article,,Scopus,2-s2.0-84880073622
"van der Burg, E., Awh, E., Olivers, C.N.L.","The Capacity of Audiovisual Integration Is Limited to One Item",2013,"Psychological Science","24","3",,"345","351",,17,10.1177/0956797612452865,"https://www.scopus.com/inward/record.uri?eid=2-s2.0-84875012932&doi=10.1177%2f0956797612452865&partnerID=40&md5=3bb9c243b70532a789ec5e107f693ff6",Article,,Scopus,2-s2.0-84875012932
"Lerner, J.S., Li, Y., Weber, E.U.","The Financial Costs of Sadness",2013,"Psychological Science","24","1",,"72","79",,33,10.1177/0956797612450302,"https://www.scopus.com/inward/record.uri?eid=2-s2.0-84872309448&doi=10.1177%2f0956797612450302&partnerID=40&md5=273722e0f0602c1acf500ab16ad514dc",Article,,Scopus,2-s2.0-84872309448
"Radke, S., Roelofs, K., de Bruijn, E.R.A.","Acting on Anger: Social Anxiety Modulates Approach-Avoidance Tendencies After Oxytocin Administration",2013,"Psychological Science","24","8",,"1573","1578",,38,10.1177/0956797612472682,"https://www.scopus.com/inward/record.uri?eid=2-s2.0-84881223815&doi=10.1177%2f0956797612472682&partnerID=40&md5=7d70995295b780173c0f4a574638a92a",Article,,Scopus,2-s2.0-84881223815
"Christine, M.-K., Jim, B.","Corrigendum to Culturally Divergent Responses to Mortality Salience (Psychological Science, (2011), 22, 8 (1019-1024), 10.1177/0956797611413935)",2013,"Psychological Science","24","5",,"813","",,,10.1177/0956797613487176,"https://www.scopus.com/inward/record.uri?eid=2-s2.0-84877347970&doi=10.1177%2f0956797613487176&partnerID=40&md5=aa47ec1b677b42c849e27df652b7803f",Erratum,,Scopus,2-s2.0-84877347970
"Hamedani, M.G., Markus, H.R., Fu, A.S.","In the Land of the Free, Interdependent Action Undermines Motivation",2013,"Psychological Science","24","2",,"189","196",,21,10.1177/0956797612452864,"https://www.scopus.com/inward/record.uri?eid=2-s2.0-84873546738&doi=10.1177%2f0956797612452864&partnerID=40&md5=f79a51801a5317dd655aff1b5ae6d18f",Article,,Scopus,2-s2.0-84873546738
"Cornelissen, G., Bashshur, M.R., Rode, J., Le Menestrel, M.","Rules or Consequences? The Role of Ethical Mind-Sets in Moral Dynamics",2013,"Psychological Science","24","4",,"482","488",,36,10.1177/0956797612457376,"https://www.scopus.com/inward/record.uri?eid=2-s2.0-84876193094&doi=10.1177%2f0956797612457376&partnerID=40&md5=f322e42cb5debc5f9295d71f1048ce11",Article,,Scopus,2-s2.0-84876193094
"Pfister, R., Dignath, D., Hommel, B., Kunde, W.","It Takes Two to Imitate: Anticipation and Imitation in Social Interaction",2013,"Psychological Science","24","10",,"2117","2121",,22,10.1177/0956797613489139,"https://www.scopus.com/inward/record.uri?eid=2-s2.0-84885341783&doi=10.1177%2f0956797613489139&partnerID=40&md5=e397f249b56fe2326b441ef2b132ba69",Article,,Scopus,2-s2.0-84885341783
"Hughes, M.L., Geraci, L., De Forrest, R.L.","Aging 5 Years in 5 Minutes: The Effect of Taking a Memory Test on Older Adults' Subjective Age",2013,"Psychological Science","24","12",,"2481","2488",,16,10.1177/0956797613494853,"https://www.scopus.com/inward/record.uri?eid=2-s2.0-84890404045&doi=10.1177%2f0956797613494853&partnerID=40&md5=672a168b6b61b9c9195956a98d55622e",Article,,Scopus,2-s2.0-84890404045
"Deary, I.J., Pattie, A., Starr, J.M.","The Stability of Intelligence From Age 11 to Age 90 Years: The Lothian Birth Cohort of 1921",2013,"Psychological Science","24","12",,"2361","2368",,41,10.1177/0956797613486487,"https://www.scopus.com/inward/record.uri?eid=2-s2.0-84890412276&doi=10.1177%2f0956797613486487&partnerID=40&md5=f7b04473a33e8c3a2dbb6497fb3098e9",Article,,Scopus,2-s2.0-84890412276
"Dunham, Y., Chen, E.E., Banaji, M.R.","Two Signatures of Implicit Intergroup Attitudes: Developmental Invariance and Early Enculturation",2013,"Psychological Science","24","6",,"860","868",,55,10.1177/0956797612463081,"https://www.scopus.com/inward/record.uri?eid=2-s2.0-84878807297&doi=10.1177%2f0956797612463081&partnerID=40&md5=48f77e8f255b26386d96f79aab559c6d",Article,,Scopus,2-s2.0-84878807297
"Jamieson, J.P., Koslov, K., Nock, M.K., Mendes, W.B.","Experiencing Discrimination Increases Risk Taking",2013,"Psychological Science","24","2",,"131","139",,44,10.1177/0956797612448194,"https://www.scopus.com/inward/record.uri?eid=2-s2.0-84873547250&doi=10.1177%2f0956797612448194&partnerID=40&md5=fa5f4025978ca717164c01db099b5ca3",Article,,Scopus,2-s2.0-84873547250
"Wang, M.-T., Eccles, J.S., Kenny, S.","Not Lack of Ability but More Choice: Individual and Gender Differences in Choice of Careers in Science, Technology, Engineering, and Mathematics",2013,"Psychological Science","24","5",,"770","775",,90,10.1177/0956797612458937,"https://www.scopus.com/inward/record.uri?eid=2-s2.0-84877319591&doi=10.1177%2f0956797612458937&partnerID=40&md5=5bece4d31b427c16575dbde8ef040d02",Article,,Scopus,2-s2.0-84877319591
"Marinovic, W., Pearce, S.L., Arnold, D.H.","Attentional-Tracking Acuity Is Modulated by Illusory Changes in Perceived Speed",2013,"Psychological Science","24","2",,"174","180",,2,10.1177/0956797612450890,"https://www.scopus.com/inward/record.uri?eid=2-s2.0-84873545961&doi=10.1177%2f0956797612450890&partnerID=40&md5=27bb1e36cc5d31e326a8a8339d724190",Article,,Scopus,2-s2.0-84873545961
"Vishwanath, D., Hibbard, P.B.","Seeing in 3-D With Just One Eye: Stereopsis Without Binocular Vision",2013,"Psychological Science","24","9",,"1673","1685",,23,10.1177/0956797613477867,"https://www.scopus.com/inward/record.uri?eid=2-s2.0-84883794677&doi=10.1177%2f0956797613477867&partnerID=40&md5=03ea155010449ae34b3e0e9fb76723ee",Article,,Scopus,2-s2.0-84883794677
"Tian, X., Huber, D.E.","Playing ""Duck Duck Goose"" With Neurons: Change Detection Through Connectivity Reduction",2013,"Psychological Science","24","6",,"819","827",,8,10.1177/0956797612459765,"https://www.scopus.com/inward/record.uri?eid=2-s2.0-84878801740&doi=10.1177%2f0956797612459765&partnerID=40&md5=bb701ac0eb9394812ed7326cf5b2bd50",Article,,Scopus,2-s2.0-84878801740
"Liu, T., Becker, M.W.","Serial Consolidation of Orientation Information Into Visual Short-Term Memory",2013,"Psychological Science","24","6",,"1044","1050",,14,10.1177/0956797612464381,"https://www.scopus.com/inward/record.uri?eid=2-s2.0-84878801550&doi=10.1177%2f0956797612464381&partnerID=40&md5=3e7a3a55ac8d411667e89e5e18632945",Article,,Scopus,2-s2.0-84878801550
"Lee, J.J., Chabris, C.F.","General Cognitive Ability and the Psychological Refractory Period: Individual Differences in the Mind's Bottleneck",2013,"Psychological Science","24","7",,"1226","1233",,8,10.1177/0956797612471540,"https://www.scopus.com/inward/record.uri?eid=2-s2.0-84880056619&doi=10.1177%2f0956797612471540&partnerID=40&md5=d7de4b17b2bd18fbdf48112efc4d487c",Article,,Scopus,2-s2.0-84880056619
"Krizan, Z., Sweeny, K.","Causes and Consequences of Expectation Trajectories: ""High"" on Optimism in a Public Ballot Initiative",2013,"Psychological Science","24","5",,"706","714",,11,10.1177/0956797612460690,"https://www.scopus.com/inward/record.uri?eid=2-s2.0-84877342388&doi=10.1177%2f0956797612460690&partnerID=40&md5=39897bb3d018ab0c25022b3b228f8392",Article,,Scopus,2-s2.0-84877342388
"Young, L.N., Cordes, S.","Fewer Things, Lasting Longer: The Effects of Emotion on Quantity Judgments",2013,"Psychological Science","24","6",,"1057","1059",,9,10.1177/0956797612465294,"https://www.scopus.com/inward/record.uri?eid=2-s2.0-84878811092&doi=10.1177%2f0956797612465294&partnerID=40&md5=9519377e729826ff602ffd721686783f",Article,,Scopus,2-s2.0-84878811092
"Verbruggen, F., Chambers, C.D., Logan, G.D.","Fictitious Inhibitory Differences: How Skewness and Slowing Distort the Estimation of Stopping Latencies",2013,"Psychological Science","24","3",,"352","362",,106,10.1177/0956797612457390,"https://www.scopus.com/inward/record.uri?eid=2-s2.0-84875039725&doi=10.1177%2f0956797612457390&partnerID=40&md5=d0df8f47f7a4011fbc8062a310401e3f",Article,,Scopus,2-s2.0-84875039725
"Kifer, Y., Heller, D., Perunovic, W.Q.E., Galinsky, A.D.","The Good Life of the Powerful: The Experience of Power and Authenticity Enhances Subjective Well-Being",2013,"Psychological Science","24","3",,"280","288",,52,10.1177/0956797612450891,"https://www.scopus.com/inward/record.uri?eid=2-s2.0-84875012659&doi=10.1177%2f0956797612450891&partnerID=40&md5=01235a83e3855d4389ad84a76d771d92",Article,,Scopus,2-s2.0-84875012659
"Hart, W.","Unlocking Past Emotion: Verb Use Affects Mood and Happiness",2013,"Psychological Science","24","1",,"19","26",,6,10.1177/0956797612446351,"https://www.scopus.com/inward/record.uri?eid=2-s2.0-84872317547&doi=10.1177%2f0956797612446351&partnerID=40&md5=52c5f8de1291bd9c58a6a5c4739a27f8",Retracted,,Scopus,2-s2.0-84872317547
"Ackerman, R.A., Kashy, D.A., Donnellan, M.B., Neppl, T., Lorenz, F.O., Conger, R.D.","The Interpersonal Legacy of a Positive Family Climate in Adolescence",2013,"Psychological Science","24","3",,"243","250",,8,10.1177/0956797612447818,"https://www.scopus.com/inward/record.uri?eid=2-s2.0-84875046847&doi=10.1177%2f0956797612447818&partnerID=40&md5=448440a2f9e43eb0d673cbe74be1d408",Article,,Scopus,2-s2.0-84875046847
"Dahl, A., Campos, J.J., Anderson, D.I., Uchiyama, I., Witherington, D.C., Ueno, M., Poutrain-Lejeune, L., Barbu-Roth, M.","The Epigenesis of Wariness of Heights",2013,"Psychological Science","24","7",,"1361","1367",,9,10.1177/0956797613476047,"https://www.scopus.com/inward/record.uri?eid=2-s2.0-84880047470&doi=10.1177%2f0956797613476047&partnerID=40&md5=3d1bde4fe71f1e126d9c4a6961bbb7bd",Article,,Scopus,2-s2.0-84880047470
"Southgate, V., Begus, K.","Motor Activation During the Prediction of Nonexecutable Actions in Infants",2013,"Psychological Science","24","6",,"828","835",,23,10.1177/0956797612459766,"https://www.scopus.com/inward/record.uri?eid=2-s2.0-84878787466&doi=10.1177%2f0956797612459766&partnerID=40&md5=841e43ed4a0de2d76fa04d74e03d09fa",Article,,Scopus,2-s2.0-84878787466
"Srinivasan, N., Hopkins, N., Reicher, S.D., Khan, S.S., Singh, T., Levine, M.","Social Meaning of Ambiguous Sounds Influences Retrospective Duration Judgments",2013,"Psychological Science","24","6",,"1060","1062",,9,10.1177/0956797612465293,"https://www.scopus.com/inward/record.uri?eid=2-s2.0-84878805534&doi=10.1177%2f0956797612465293&partnerID=40&md5=d712adc20593e6bf620ef4e5b6fbce2b",Article,,Scopus,2-s2.0-84878805534
"Sutin, A.R., Terracciano, A., Milaneschi, Y., An, Y., Ferrucci, L., Zonderman, A.B.","The Effect of Birth Cohort on Well-Being: The Legacy of Economic Hard Times",2013,"Psychological Science","24","3",,"379","385",,20,10.1177/0956797612459658,"https://www.scopus.com/inward/record.uri?eid=2-s2.0-84875029246&doi=10.1177%2f0956797612459658&partnerID=40&md5=25842799e8626fb0231e949cb16c9e7c",Article,,Scopus,2-s2.0-84875029246
"Cole, G.G., Wilkins, A.J.","Fear of Holes",2013,"Psychological Science","24","10",,"1980","1985",,24,10.1177/0956797613484937,"https://www.scopus.com/inward/record.uri?eid=2-s2.0-84882799671&doi=10.1177%2f0956797613484937&partnerID=40&md5=14adb6b1f4aef1a2759fafda4fa568f0",Article,,Scopus,2-s2.0-84882799671
"Hsee, C.K., Zhang, J., Cai, C.F., Zhang, S.","Overearning",2013,"Psychological Science","24","6",,"852","859",,15,10.1177/0956797612464785,"https://www.scopus.com/inward/record.uri?eid=2-s2.0-84878811939&doi=10.1177%2f0956797612464785&partnerID=40&md5=da94747bc036b6faf55b0fa51b18bc89",Article,,Scopus,2-s2.0-84878811939
